username;date;retweets;favorites;text;geo;mentions;hashtags;id;permalink
;2019-03-10 23:36;0;0;"2019-03-08 Short sale volume (not short interest) for $ MNST is 45%. http://shortvolumes.com/?t=MNST $ PEP 40% $ REED 70%";;;;"1104888673584234502";https://twitter.com/shortvolumes/status/1104888673584234502
;2019-03-10 21:54;0;4;"Sugar water and foods laced with chemicals has created secular tailwinds for $ tndm and $ dxcm thanks to companies like $ pep and $ ko";;;;"1104863086366797824";https://twitter.com/hiddensmallcaps/status/1104863086366797824
;2019-03-10 21:53;0;0;"Allstate Upped Pepsico $ PEP Holding; New York State Common Retirement Fund Boosted Its Intuit $ INTU Positionhttps://finreviewer.com/2019/03/10/allstate-upped-pepsico-pep-holding-new-york-state-common-retirement-fund-boosted-its-intuit-intu-position/ …";;;;"1104862828140351489";https://twitter.com/thefinreviewer/status/1104862828140351489
;2019-03-10 21:52;0;0;"Kelly Lawrence W & Associates Cut Holding in Pepsico $ PEP by $1.53 Million; Facebook $ FB Holder Pittenger & Anderson Decreased Position by $4.62 Million as Market Value Rose https://finexaminer.com/2019/03/10/kelly-lawrence-w-facebook-fb-holder-pittenger-anderson-decreased-position-by-4-62-million-as-market-value-rose/ …";;;;"1104862503551545344";https://twitter.com/thefinreviewer/status/1104862503551545344
;2019-03-10 21:44;0;0;"Beach Investment Counsel Raised Position in Pepsico $ PEP by $8.19 Million; As Gilead Sciences $ GILD Stock Declined, Violich Capital Management Has Decreased Stakehttps://hinewulm.com/2019/03/10/beach-investment-counsel-raised-position-in-pepsico-pep-by-8-19-million-as-gilead-sciences-gild-stock-declined-violich-capital-management-has-decreased-stake/ …";;;;"1104860550641737729";https://twitter.com/UlmHi/status/1104860550641737729
;2019-03-10 21:24;0;0;"Pepsico $ PEP Market Value Declined While Godsey & Gibb Associates Lowered Holding by $948,310; Morningstar $ MORN Holder Golden Gate Private Equity Has Decreased Holding by $381,500https://yomiblog.com/2019/03/10/pepsico-pep-market-value-declined-while-godsey-morningstar-morn-holder-golden-gate-private-equity-has-decreased-holding-by-381500/ …";;;;"1104855513454596096";https://twitter.com/BlogYomi/status/1104855513454596096
;2019-03-10 21:06;0;0;"Connors Investor Services Increased Its Holding in Pepsico $ PEP by $3.10 Million; Northern Trust $ NTRS Share Value Declined While Fairview Capital Investment Management Has Raised Position https://yomiblog.com/2019/03/10/connors-investor-services-increased-its-holding-in-pepsico-pep-by-3-10-million-northern-trust-ntrs-share-value-declined-while-fairview-capital-investment-management-has-raised-position/ …";;;;"1104850956276195328";https://twitter.com/BlogYomi/status/1104850956276195328
;2019-03-10 20:44;0;0;"Jacobs Levy Equity Management Decreased Holding in Equity Residential $ EQR by $516,780; Pepsico $ PEP Holder Lindsell Train LTD Lowered Stake by $12.10 Million https://yomiblog.com/2019/03/10/jacobs-levy-equity-management-decreased-holding-in-equity-residential-eqr-by-516780-pepsico-pep-holder-lindsell-train-ltd-lowered-stake-by-12-10-million/ …";;;;"1104845580713553933";https://twitter.com/BlogYomi/status/1104845580713553933
;2019-03-10 20:42;0;0;"As Pepsico $ PEP Share Price Declined, Shareholder Loeb Partners Lowered Position; Apg Asset Management Nv Has Lowered Its Dominion Energy $ D Holding as Shares Rose https://yomiblog.com/2019/03/10/as-pepsico-pep-share-price-declined-shareholder-loeb-partners-lowered-position-apg-asset-management-nv-has-lowered-its-dominion-energy-d-holding-as-shares-rose/ …";;;;"1104844989744455680";https://twitter.com/BlogYomi/status/1104844989744455680
;2019-03-10 20:38;0;0;"Fiduciary Management Has Raised Its Holding in Pepsico $ PEP by $45.36 Million as Market Valuation Declined; Seatown Holdings Has Cut Its Position in Icici Bk LTD $ IBN as Valuation Declined https://hinewulm.com/2019/03/10/fiduciary-management-has-raised-its-holding-in-pepsico-pep-by-45-36-million-as-market-valuation-declined-seatown-holdings-has-cut-its-position-in-icici-bk-ltd-ibn-as-valuation-declined/ …";;;;"1104844079370780673";https://twitter.com/UlmHi/status/1104844079370780673
;2019-03-10 20:36;0;0;"Short sale vol (not short interest) for $ KHC on 2019-03-08 is 41%. http://shortvolumes.com/?t=KHC $ SJM 55% $ THS 51% $ TSN 41% $ PEP 40%";;;;"1104843371510710278";https://twitter.com/shortvolumes/status/1104843371510710278
;2019-03-10 20:25;0;0;"Pepsico $ PEP Stock Declined While Cohen Klingenstein Trimmed Its Position by $335,500; Monetary Management Group Has Trimmed Stake in Pepsico $ PEP by $539,550 https://finexaminer.com/2019/03/10/pepsico-pep-stock-declined-while-cohen-klingenstein-trimmed-its-position-by-335500-monetary-management-group-has-trimmed-stake-in-pepsico-pep-by-539550/ …";;;;"1104840712825331713";https://twitter.com/thefinreviewer/status/1104840712825331713
;2019-03-10 20:20;0;0;"Bright Rock Capital Management Holding In Pepsico $ PEP Was Increased; Pinnacle Advisory Group Has Decreased Arch Cap Group LTD $ ACGL Position as Share Price Rose https://finexaminer.com/2019/03/10/bright-rock-capital-management-holding-in-pepsico-pep-was-increased-pinnacle-advisory-group-has-decreased-arch-cap-group-ltd-acgl-position-as-share-price-rose/ …";;;;"1104839469579071488";https://twitter.com/thefinreviewer/status/1104839469579071488
;2019-03-10 20:07;0;0;"As Incyte $ INCY Stock Price Rose, Armistice Capital Has Trimmed Its Position; As Pepsico $ PEP Stock Value Declined, Holder Rbf Capital Has Trimmed Position by $550,000 https://yomiblog.com/2019/03/10/as-incyte-incy-stock-price-rose-armistice-capital-has-trimmed-its-position-as-pepsico-pep-stock-value-declined-holder-rbf-capital-has-trimmed-position-by-550000/ …";;;;"1104836221929512962";https://twitter.com/BlogYomi/status/1104836221929512962
;2019-03-10 19:56;0;0;"Tealwood Asset Management Has Lowered Its Western Alliance Bancorp $ WAL Stake by $1.42 Million as Share Value Declined; Woodley Farra Manion Portfolio Management Holding In Pepsico $ PEP Was Upped https://yomiblog.com/2019/03/10/tealwood-asset-management-has-lowered-its-western-alliance-bancorp-wal-stake-by-1-42-million-as-share-value-declined-woodley-farra-manion-portfolio-management-holding-in-pepsico-pep-was-upped/ …";;;;"1104833371136552960";https://twitter.com/BlogYomi/status/1104833371136552960
;2019-03-10 19:52;0;0;"Middleton & Co Has Increased By $1.12 Million Its Pepsico $ PEP Position; Fncb Bancorp $ FNCB Shorts Raised By 5.88%https://finheadlines.com/2019/03/10/middleton-fncb-bancorp-fncb-shorts-raised-by-5-88/ …";;;;"1104832506610749440";https://twitter.com/HeadlinesFin/status/1104832506610749440
;2019-03-10 18:36;0;0;"Philip Morris Intl $ PM Shareholder Usca Ria Increased Position; Jones Financial Companies Lllp Decreased Pepsico $ PEP Position by $444,950 as Stock Declined https://finreviewer.com/2019/03/10/philip-morris-intl-pm-shareholder-usca-ria-increased-position-jones-financial-companies-lllp-decreased-pepsico-pep-position-by-444950-as-stock-declined/ …";;;;"1104813188418322433";https://twitter.com/thefinreviewer/status/1104813188418322433
;2019-03-10 18:35;0;0;"Mastec $ MTZ Shareholder Ameritas Investment Partners Lifted Position; Advisor Partners Has Increased Its Pepsico $ PEP Holding by $881,100 as Market Value Declined https://finexaminer.com/2019/03/10/mastec-mtz-shareholder-ameritas-investment-partners-lifted-position-advisor-partners-has-increased-its-pepsico-pep-holding-by-881100-as-market-value-declined/ …";;;;"1104812920335200256";https://twitter.com/thefinreviewer/status/1104812920335200256
;2019-03-10 18:27;0;0;"As Pepsico $ PEP Valuation Declined, Cypress Asset Management Has Decreased Position; Contour Asset Management Has Lowered Realpage $ RP Stake as Market Valuation Rosehttps://finreviewer.com/2019/03/10/as-pepsico-pep-valuation-declined-cypress-asset-management-has-decreased-position-contour-asset-management-has-lowered-realpage-rp-stake-as-market-valuation-rose/ …";;;;"1104810935997353984";https://twitter.com/thefinreviewer/status/1104810935997353984
;2019-03-10 18:26;0;0;"First Hawaiian Bank Trimmed Its Stake in Amgen $ AMGN by $476,464 as Shares Declined; Pictet & Cie Europe Sa Has Boosted Its Pepsico $ PEP Position by $948,860; Market Value Declined https://finexaminer.com/2019/03/10/first-hawaiian-bank-trimmed-its-stake-in-amgen-amgn-by-476464-as-shares-declined-pictet-market-value-declined/ …";;;;"1104810742048571395";https://twitter.com/thefinreviewer/status/1104810742048571395
;2019-03-10 18:22;0;0;"As Blackrock $ BLK Market Valuation Rose, Mogy Joel R Investment Counsel Lifted Position; Hengehold Capital Management Holding in Pepsico $ PEP Has Lifted as Share Price Declined https://finheadlines.com/2019/03/10/as-blackrock-blk-market-valuation-rose-mogy-joel-r-investment-counsel-lifted-position-hengehold-capital-management-holding-in-pepsico-pep-has-lifted-as-share-price-declined/ …";;;;"1104809790113529856";https://twitter.com/HeadlinesFin/status/1104809790113529856
;2019-03-10 18:16;1;1;"Investors Buy PepsiCo $ PEP on Weakness After Insider Selling http://tickerreport.com/?p=4211821";;;;"1104808382790279169";https://twitter.com/TickerReport/status/1104808382790279169
;2019-03-10 17:58;0;0;"Barrett Asset Management Lowered Its Holding in Pepsico Com $ PEP as Valuation Declined; Exxon Mobil Com $ XOM Shares Rose While Donaldson Capital Management Has Lowered Its Stakehttps://finheadlines.com/2019/03/10/barrett-asset-management-lowered-its-holding-in-pepsico-com-pep-as-valuation-declined-exxon-mobil-com-xom-shares-rose-while-donaldson-capital-management-has-lowered-its-stake/ …";;;;"1104803807815495680";https://twitter.com/HeadlinesFin/status/1104803807815495680
;2019-03-10 17:02;0;0;"Investors Buy Shares of PepsiCo $ PEP on Weakness After Insider Selling http://weekherald.com/?p=3566115";;;;"1104789519168126976";https://twitter.com/WeekHerald/status/1104789519168126976
;2019-03-10 16:59;0;0;"Investors Buy Shares of PepsiCo $ PEP on Weakness Following Insider Selling http://theolympiareport.com/?p=1503609";;;;"1104788836859678721";https://twitter.com/OlympiaReport/status/1104788836859678721
;2019-03-10 16:41;0;0;"As Pepsico $ PEP Stock Price Declined, Woodley Farra Manion Portfolio Management Upped by $694,650 Its Holding; Armstrong Henry H Associates Has Cut Holding in Johnson & Johnson $ JNJ by $599,463 as Stock Declinedhttps://yomiblog.com/2019/03/10/as-pepsico-pep-stock-price-declined-woodley-farra-manion-portfolio-management-upped-by-694650-its-holding-armstrong-henry-h-associates-has-cut-holding-in-johnson-johnson-jnj-by-599463-as-s/ …";;;;"1104784239533441025";https://twitter.com/BlogYomi/status/1104784239533441025
;2019-03-10 16:20;0;0;"$ PEP 4 times the 20 MA hold support pic.twitter.com/I7OMRusTAz";;;;"1104779117550059522";https://twitter.com/LlcBillionaire/status/1104779117550059522
;2019-03-10 15:58;0;0;"Northeast Financial Consultants Has Upped Pepsico $ PEP Position by $625,130 as Share Value Declined; Lomas Capital Management Boosted Position in Twenty First Centy Fox $ FOX by $3.25 Million as Stock Price Rose https://finexaminer.com/2019/03/10/northeast-financial-consultants-has-upped-pepsico-pep-position-by-625130-as-share-value-declined-lomas-capital-management-boosted-position-in-twenty-first-centy-fox-fox-by-3-25-million-as-stoc/ …";;;;"1104773446901395456";https://twitter.com/thefinreviewer/status/1104773446901395456
;2019-03-10 15:56;0;0;"Alethea Capital Management Upped Pepsico $ PEP Stake; Tractor Supply Co $ TSCO Shareholder Harvest Capital Strategies Increased Its Holding by $393,669https://finheadlines.com/2019/03/10/alethea-capital-management-upped-pepsico-pep-stake-tractor-supply-co-tsco-shareholder-harvest-capital-strategies-increased-its-holding-by-393669/ …";;;;"1104772904753995776";https://twitter.com/HeadlinesFin/status/1104772904753995776
;2019-03-10 15:31;0;0;"Fishman Jay A LTD Holds Holding in Pepsico $ PEP; Illumina $ ILMN Stock Value Declined While Next Century Growth Investors Decreased by $478,998 Its Positionhttps://finheadlines.com/2019/03/10/fishman-jay-a-ltd-holds-holding-in-pepsico-pep-illumina-ilmn-stock-value-declined-while-next-century-growth-investors-decreased-by-478998-its-position/ …";;;;"1104766815039827968";https://twitter.com/HeadlinesFin/status/1104766815039827968
;2019-03-10 15:18;0;0;"Bellecapital International LTD Trimmed Its Amazon Com $ AMZN Position by $483,322; Gladius Capital Management LP Raised Its Pepsico $ PEP Holding https://hinewulm.com/2019/03/10/bellecapital-international-ltd-trimmed-its-amazon-com-amzn-position-by-483322-gladius-capital-management-lp-raised-its-pepsico-pep-holding/ …";;;;"1104763437933101057";https://twitter.com/UlmHi/status/1104763437933101057
;2019-03-10 15:12;0;0;"Lawson Kroeker Investment Management Has Raised Stake in Chevron $ CVX as Market Valuation Rose; Pepsico $ PEP Holder Sanders Capital Has Trimmed Its Stake by $129.46 Million as Stock Value Declined https://hinewulm.com/2019/03/10/lawson-kroeker-investment-management-has-raised-stake-in-chevron-cvx-as-market-valuation-rose-pepsico-pep-holder-sanders-capital-has-trimmed-its-stake-by-129-46-million-as-stock-value-declined/ …";;;;"1104761876339134465";https://twitter.com/UlmHi/status/1104761876339134465
;2019-03-10 14:41;0;0;"Blue Chip Partners Increased Pepsico $ PEP Holding by $501,930 as Valuation Declined; Rock Springs Capital Management LP Boosted Idexx Labs $ IDXX Stake https://yomiblog.com/2019/03/10/blue-chip-partners-increased-pepsico-pep-holding-by-501930-as-valuation-declined-rock-springs-capital-management-lp-boosted-idexx-labs-idxx-stake/ …";;;;"1104754146908037120";https://twitter.com/BlogYomi/status/1104754146908037120
;2019-03-10 13:25;0;0;"Sanders Capital Cut Pepsico $ PEP Holding as Stock Declined; Bank Of America $ BAC Market Value Rose While Howard Capital Management Has Trimmed Position https://yomiblog.com/2019/03/10/sanders-capital-cut-pepsico-pep-holding-as-stock-declined-bank-of-america-bac-market-value-rose-while-howard-capital-management-has-trimmed-position/ …";;;;"1104735017035476993";https://twitter.com/BlogYomi/status/1104735017035476993
;2019-03-10 13:21;0;0;"Yeah.... $ aapl $ amzn $ agn $ brk $ cmg $ crm $ dis $ esrx $ f $ ge $ gm $ hlf $ iep $ ibm $ jnj $ ko $ pep $ lly $ msft $ nflx $ azn $ googl $ wmt $ wba $ rad $ myl $ mrk $ mcd $ qsr $ snap $ tsla $ tst $ bhc $ fbpic.twitter.com/SyVwCyD05Y";;;;"1104734008615813120";https://twitter.com/brianfires/status/1104734008615813120
;2019-03-10 13:19;0;0;"Pepsico $ PEP Holder Asset Management Group Decreased Position as Shares Declined; As A T & T $ T Share Price Declined, Shareholder Klingenstein Fields & Co Has Lowered Holding https://yomiblog.com/2019/03/10/pepsico-pep-holder-asset-management-group-decreased-position-as-shares-declined-as-a-t-t-t-share-price-declined-shareholder-klingenstein-fields-co-has-lowered-holding/ …";;;;"1104733536152702976";https://twitter.com/BlogYomi/status/1104733536152702976
;2019-03-10 12:57;0;0;"As Nelnet $ NNI Share Value Declined, General American Investors Company Has Boosted by $650,000 Its Position; Hengehold Capital Management Boosted Position in Pepsico $ PEP by $1.86 Million as Share Price Declined https://finreviewer.com/2019/03/10/as-nelnet-nni-share-value-declined-general-american-investors-company-has-boosted-by-650000-its-position-hengehold-capital-management-boosted-position-in-pepsico-pep-by-1-86-million-as-share/ …";;;;"1104728008559083521";https://twitter.com/thefinreviewer/status/1104728008559083521
;2019-03-10 12:56;0;0;"Busey Trust Company Increased Its Stake in Pepsico $ PEP by $368,390 as Stock Value Declined; Odey Asset Management Group LTD Lowered Stake in Cadiz $ CDZI by $747,020https://finheadlines.com/2019/03/10/busey-trust-company-increased-its-stake-in-pepsico-pep-by-368390-as-stock-value-declined-odey-asset-management-group-ltd-lowered-stake-in-cadiz-cdzi-by-747020/ …";;;;"1104727602894385153";https://twitter.com/HeadlinesFin/status/1104727602894385153
;2019-03-10 12:46;0;0;"As Synnex $ SNX Shares Rose, Holder Delphi Management Upped Holding; As Pepsico $ PEP Stock Price Declined, Janney Montgomery Scott Has Lowered Its Holding https://finreviewer.com/2019/03/10/as-synnex-snx-shares-rose-holder-delphi-management-upped-holding-as-pepsico-pep-stock-price-declined-janney-montgomery-scott-has-lowered-its-holding/ …";;;;"1104725282634825728";https://twitter.com/thefinreviewer/status/1104725282634825728
;2019-03-10 12:43;0;0;"As Pepsico $ PEP Share Price Declined, Bislett Management Decreased Position by $1.10 Million; Gotham Asset Management Has Lifted Its Pfizer $ PFE Position by $6.05 Million https://finexaminer.com/2019/03/10/as-pepsico-pep-share-price-declined-bislett-management-decreased-position-by-1-10-million-gotham-asset-management-has-lifted-its-pfizer-pfe-position-by-6-05-million/ …";;;;"1104724503840595968";https://twitter.com/thefinreviewer/status/1104724503840595968
;2019-03-10 12:37;0;0;"Everence Capital Management Has Raised Its Stake in Cvs Health Ord $ CVS by $416,390; Pepsico $ PEP Shareholder Rice Hall James & Associates Has Cut Its Stake https://finheadlines.com/2019/03/10/everence-capital-management-has-raised-its-stake-in-cvs-health-ord-cvs-by-416390-pepsico-pep-shareholder-rice-hall-james-associates-has-cut-its-stake/ …";;;;"1104722904317599744";https://twitter.com/HeadlinesFin/status/1104722904317599744
;2019-03-10 12:34;0;0;"Blue Chip Partners Raised Stake in Pepsico $ PEP by $501,930; Fiserv $ FISV Shares Rose While Marshall & Sullivan Has Cut by $381,133 Its Holding https://finexaminer.com/2019/03/10/blue-chip-partners-raised-stake-in-pepsico-pep-by-501930-fiserv-fisv-shares-rose-while-marshall-sullivan-has-cut-by-381133-its-holding/ …";;;;"1104722121559818240";https://twitter.com/thefinreviewer/status/1104722121559818240
;2019-03-10 12:20;0;0;"As Amazon Com $ AMZN Share Value Rose, Partner Fund Management LP Increased by $33.60 Million Its Holding; Hudson Valley Investment Advisors Has Increased Holding in Pepsico $ PEP as Shares Declined https://finheadlines.com/2019/03/10/as-amazon-com-amzn-share-value-rose-partner-fund-management-lp-increased-by-33-60-million-its-holding-hudson-valley-investment-advisors-has-increased-holding-in-pepsico-pep-as-shares-declined/ …";;;;"1104718587116302338";https://twitter.com/HeadlinesFin/status/1104718587116302338
;2019-03-10 12:14;0;0;"Viper Energy Partners LP $ Call $ VNOM Shareholder Rr Advisors Cut Stake as Stock Value Rose; As Pepsico $ PEP Stock Value Declined, Fishman Jay A LTD Raised Its Position by $2.43 Million https://finheadlines.com/2019/03/10/viper-energy-partners-lp-call-vnom-shareholder-rr-advisors-cut-stake-as-stock-value-rose-as-pepsico-pep-stock-value-declined-fishman-jay-a-ltd-raised-its-position-by-2-43-million/ …";;;;"1104717236307222528";https://twitter.com/HeadlinesFin/status/1104717236307222528
;2019-03-10 12:05;0;0;"Pepsico $ PEP Stock Price Declined While Lindsell Train LTD Lowered by $12.10 Million Its Holding; Two Sigma Securities Stake in Newmont Mining $ Put $ NEM Lowered by $1.85 Million as Market Valuation Rosehttps://yomiblog.com/2019/03/10/pepsico-pep-stock-price-declined-while-lindsell-train-ltd-lowered-by-12-10-million-its-holding-two-sigma-securities-stake-in-newmont-mining-put-nem-lowered-by-1-85-million-as-market-valuation/ …";;;;"1104714915766562816";https://twitter.com/BlogYomi/status/1104714915766562816
;2019-03-10 12:04;0;0;"As Pepsico INC $ PEP Shares Declined, Sit Investment Associates INC Decreased Its Stake by $5.52 Million https://enbulletin.com/2019/03/10/as-pepsico-inc-pep-shares-declined-sit-investment-associates-inc-decreased-its-stake-by-5-52-million/ …";;;;"1104714706076483584";https://twitter.com/bulletin_en/status/1104714706076483584
;2019-03-10 12:01;0;0;"Pepsico INC $ PEP Holder Sit Investment Associates INC Has Trimmed Stake as Stock Declined https://whatsonthorold.com/2019/03/10/pepsico-inc-pep-holder-sit-investment-associates-inc-has-trimmed-stake-as-stock-declined/ …";;;;"1104713837712949249";https://twitter.com/whatsonthorold2/status/1104713837712949249
;2019-03-10 11:55;0;0;"Capital Advisors Upped Its Position in Medical Pptys Trust $ MPW by $433,120 as Market Value Rose; Strategic Financial Services Lifted Position in Pepsico $ PEP as Market Valuation Declined https://yomiblog.com/2019/03/10/capital-advisors-upped-its-position-in-medical-pptys-trust-mpw-by-433120-as-market-value-rose-strategic-financial-services-lifted-position-in-pepsico-pep-as-market-valuation-declined/ …";;;;"1104712370079834112";https://twitter.com/BlogYomi/status/1104712370079834112
;2019-03-10 11:45;0;0;"Haverford Trust Company Has Upped Pepsico $ PEP Position by $1.17 Million; First Dallas Securities Has Upped Its Eagle Materials $ EXP Positionhttps://hinewulm.com/2019/03/10/haverford-trust-company-has-upped-pepsico-pep-position-by-1-17-million-first-dallas-securities-has-upped-its-eagle-materials-exp-position/ …";;;;"1104709799047057410";https://twitter.com/UlmHi/status/1104709799047057410
;2019-03-10 11:36;0;0;"Short sale volume (not short interest) for $ KO on 2019-03-08 is 35%. http://shortvolumes.com/?t=KO $ PEP 40% $ KOF 54% $ FIZZ 65%";;;;"1104707478959411201";https://twitter.com/shortvolumes/status/1104707478959411201
;2019-03-10 11:13;0;0;"Pepsico $ PEP Shareholder Plante Moran Financial Advisors Trimmed Its Stake; Bradley Foster & Sargent Raised State Street $ STT Holding https://hinewulm.com/2019/03/10/pepsico-pep-shareholder-plante-moran-financial-advisors-trimmed-its-stake-bradley-foster-sargent-raised-state-street-stt-holding/ …";;;;"1104701711107719168";https://twitter.com/UlmHi/status/1104701711107719168
;2019-03-10 11:09;0;0;"Vivek Sankaran Sells 13,000 Shares of PepsiCo, Inc. $ PEP Stock http://theolympiareport.com/?p=1502650";;;;"1104700683956162560";https://twitter.com/OlympiaReport/status/1104700683956162560
;2019-03-10 11:00;0;0;"Short sale volume (not short interest) for $ CAG on 2019-03-08 is 52%. http://shortvolumes.com/?t=CAG $ PEP 40% $ THS 51% $ SJM 55% $ GIS 61%";;;;"1104698417677287431";https://twitter.com/shortvolumes/status/1104698417677287431
;2019-03-10 10:29;0;0;"Veracyte $ VCYT Holder Clough Capital Partners LP Has Upped Holding; Markston International Decreased Pepsico $ PEP Stake by $308,000 as Stock Declined https://finreviewer.com/2019/03/10/veracyte-vcyt-holder-clough-capital-partners-lp-has-upped-holding-markston-international-decreased-pepsico-pep-stake-by-308000-as-stock-declined/ …";;;;"1104690738850381824";https://twitter.com/thefinreviewer/status/1104690738850381824
;2019-03-10 10:24;0;0;"North American Management Has Lowered Stake in Pepsico $ PEP by $412,390 as Market Valuation Declined; As Donaldson $ DCI Shares Declined, Quantum Capital Management Trimmed Stake by $354,922 https://finexaminer.com/2019/03/10/north-american-management-has-lowered-stake-in-pepsico-pep-by-412390-as-market-valuation-declined-as-donaldson-dci-shares-declined-quantum-capital-management-trimmed-stake-by-354922/ …";;;;"1104689567419035649";https://twitter.com/thefinreviewer/status/1104689567419035649
;2019-03-10 09:20;0;0;"Credit Suisse Group Begins Coverage on PepsiCo $ PEP http://macondaily.com/?p=1595756";;;;"1104673480627367936";https://twitter.com/macondailynews/status/1104673480627367936
;2019-03-10 05:10;0;0;"I'm in the mkt for a girlfriend & to make some ! Anybody? $ aapl $ amzn $ agn $ brk $ bhc $ crm $ cmg $ esrx $ f $ googl $ hlf $ iep $ ibm $ jnj $ ko $ wba $ wmt $ tgt $ fb $ mcd $ shak $ ms $ gs $ wfc $ bac $ c $ jpm $ sbux $ cat $ ba $ tst $ pg $ cpb $ pep $ tsla $ btc $ teva $ irwd $ p $ wba $ eols $ pfe $ bmy $ amgn";;;;"1104610342351630338";https://twitter.com/brianfires/status/1104610342351630338
;2019-03-10 05:00;0;0;"Short sale volume(not short interest) for $ SBUX on 2019-03-08 is 31%. http://shortvolumes.com/?t=SBUX $ DNKN 58% $ PEP 40% $ YUM 54% $ WEN 68%";;;;"1104607823105871872";https://twitter.com/shortvolumes/status/1104607823105871872
;2019-03-10 04:46;0;0;"25% of # Allergan '16 Intangibles Have No Remaining Life. Another $17B! $ aapl $ amzn $ agn $ brk $ bhc $ crm $ cmg $ esrx $ f $ hlf $ iep $ ibm $ jnj $ ko $ prgo $ wba $ wmt $ tgt $ fb $ ms $ gs $ wfc $ bac $ c $ jpm $ sbux $ cat $ ba $ tst $ pg $ cpb $ pep $ tsla $ btc $ teva $ irwd $ p $ wba $ eols $ pfe $ bmy $ amgnpic.twitter.com/wDB0iQHnZr";;;#;"1104604521567801344";https://twitter.com/brianfires/status/1104604521567801344
;2019-03-10 04:42;0;0;"Most of # Allergan's Intangible Assets Are Aged! Overstated @$73B Now? $ aapl $ amzn $ agn $ brk $ bhc $ crm $ cmg $ esrx $ hlf $ iep $ ibm $ jnj $ ko $ prgo $ wba $ wmt $ tgt $ fb $ shak $ ms $ gs $ wfc $ bac $ c $ jpm $ sbux $ cat $ ba $ tst $ pg $ cpb $ pep $ tsla $ btc $ teva $ irwd $ wba $ eols $ pfe $ bmy $ amgnpic.twitter.com/iKneD9OPLz";;@;#;"1104603314854002690";https://twitter.com/brianfires/status/1104603314854002690
;2019-03-10 04:18;0;1;"https://bit.ly/2zvlY8Y Nathan Bears Story of Becoming a Millionaire Trader!! $ PEP $ AMFE $ OWCP $ FNMA";;;;"1104597294949847040";https://twitter.com/Sw1ng_Trader/status/1104597294949847040
;2019-03-10 01:58;0;1;"$ PEP weekly. For me, nothing to do until we breach 122.15 -- until then, it's range trading and effectively gambling on a directional outcome. Especially given double top. Lesson here: know your levels, know how you trade, and wait for your pitch to hit. pic.twitter.com/kG5upmgt67";;;;"1104562043531771905";https://twitter.com/theycallmetex/status/1104562043531771905
;2019-03-10 00:35;0;0;"Maybe I'll have a $ PEP instead of a $ KO.pic.twitter.com/TWfVEFDgpu";;;;"1104541250647027712";https://twitter.com/ADBYNOT/status/1104541250647027712