username;date;retweets;favorites;text;geo;mentions;hashtags;id;permalink
;2019-03-11 10:48;0;0;"Discovery Capital Management Lowered Advanced Micro Devices $ AMD Stake by $35.04 Million as Share Value Rose; Abbvie $ ABBV Stock Price Declined While Loudon Investment Management Increased by $898,932 Its Stake https://finheadlines.com/2019/03/11/discovery-capital-management-lowered-advanced-micro-devices-amd-stake-by-35-04-million-as-share-value-rose-abbvie-abbv-stock-price-declined-while-loudon-investment-management-increased-by-8989/ …";;;;"1105057801645244418";https://twitter.com/HeadlinesFin/status/1105057801645244418
;2019-03-11 10:40;0;0;"Lvm Capital Management LTD Has Raised Abbvie $ ABBV Holding By $444,912; The Walt Disney Company $ DIS Covered By 5 Bullshttps://yomiblog.com/2019/03/11/lvm-capital-management-ltd-has-raised-abbvie-abbv-holding-by-444912-the-walt-disney-company-dis-covered-by-5-bulls/ …";;;;"1105055902988677120";https://twitter.com/BlogYomi/status/1105055902988677120
;2019-03-11 10:06;0;0;"As Abbvie Com $ ABBV Share Value Declined, Canada Pension Plan Investment Board Has Decreased Its Stake; Leuthold Group Increases Position in Cigna $ CI https://hinewulm.com/2019/03/11/as-abbvie-com-abbv-share-value-declined-canada-pension-plan-investment-board-has-decreased-its-stake-leuthold-group-increases-position-in-cigna-ci/ …";;;;"1105047447762620416";https://twitter.com/UlmHi/status/1105047447762620416
;2019-03-11 05:28;0;0;"# AbbVie Announces Multiple Milestones for Phase 3 # CLL14 # Venetoclax Study of Fixed Duration Treatment in Previously-Untreated # ChronicLymphocyticLeukemia Patients $ ABBV http://www.1stoncology.com/blog/abbvie-announces-multiple-milestones-for-phase-3-cll14-venetoclax-study-of-fixed-duration-treatment-in-previously-untreated-chronic-lymphocytic-leukemia-patients1234534103 …";;;# # # #;"1104977388130263040";https://twitter.com/1stOncology/status/1104977388130263040
;2019-03-11 03:50;0;2;"Let's see what this week brings. On Friday I bought $ ABBV $ TEVA and $ KO. What did you buy last week $ SPY $ DJIA # stockspic.twitter.com/cKLo8VTj6R";;;#;"1104952794333700098";https://twitter.com/RedTieRonnie/status/1104952794333700098