username;date;retweets;favorites;text;geo;mentions;hashtags;id;permalink
;2019-03-26 22:33;0;0;"Medtronic's Implantable Defibrillators Vulnerable to Life-Threatening Hacks https://thehackernews.com/2019/03/hacking-implantable-defibrillators.html … # cybersecurity # hacker # infosec # security # cyber # tech # gdpr # opensource # cybercrime # cryptocurrency # malware # hacking # hacked # news # databreach # hackers # data # google # bigdata";;;# # # # # # # # # # # # # # # # # # #;"1110671259854143489";https://twitter.com/Ven0mSecurity/status/1110671259854143489
;2019-03-26 22:30;0;0;"Thank you so much for replying back. I see the surgeon in 2 weeks, and I will ask if the Medtronic unit is interchangeable. I will ask my movement doctor on Friday the same. Also it was general anesthesia. Checked in 5:30, wheeled into OR 07:30, woke up about 9:15, left 11:30";;;;"1110670331759464451";https://twitter.com/cdhead1969/status/1110670331759464451
;2019-03-26 21:54;5;6;"Homeland Security issued an alert to warn of critical vulnerabilities impacting numerous Medtronic devices, which are exploitable with low skill level. # cybersecurity # infosec # Compliance # privacy # healthcareIT # informationsecurity # healthcare https://www.securityweek.com/dhs-warns-vulnerabilities-medtronic-defibrillators …";;;# # # # # # #;"1110661276303327232";https://twitter.com/JeffEnglander/status/1110661276303327232
;2019-03-26 21:39;0;1;"Learn about the future of # DigitaHealth # Diabetes from # Insulet # Bigfoot # Ascensia # EvidationHealth # Onduo # Medtronic and others including # FDA https://www.diabetestechnology.org/ddc/ pic.twitter.com/Y8ixsLbDIe";;;# # # # # # # # #;"1110657534816223232";https://twitter.com/GoDiabetesMD/status/1110657534816223232
;2019-03-26 21:30;0;0;"Jay, our technical support may have options for you. Please give our team a call at 800.646.4633 option #1.";;;#1;"1110655395343802370";https://twitter.com/MDT_Diabetes/status/1110655395343802370
;2019-03-26 21:29;0;0;"I pacemaker di Medtronic a rischio cracking https://www.punto-informatico.it/pacemaker-medtronic-rischio-cracking/?refresh_ce …";;;;"1110655063318544384";https://twitter.com/PulciniRemo/status/1110655063318544384
;2019-03-26 21:23;0;0;"I'm sorry to hear this. I encourage you to work with your local team to discuss your concerns in more detail. You can check here http://bit.ly/1ce3pEc for the office closest to you to learn more.";;;;"1110653650647597056";https://twitter.com/MDT_Diabetes/status/1110653650647597056
;2019-03-26 21:23;1;1;"I'm sorry to hear about your pump, Ashwaq. Your local team will have the most up to date info on our latest products available in your area. Please check here http://bit.ly/1ce3pEc for the office closest to you to learn more.";;;;"1110653514609500161";https://twitter.com/MDT_Diabetes/status/1110653514609500161
;2019-03-26 21:21;2;7;"The new 0.71 from Medtronic is pretty slick as well...";;;;"1110653140985102341";https://twitter.com/italolinfante/status/1110653140985102341
;2019-03-26 21:15;0;0;"Good thing for @ aethoco Medtronic launches med-tech accelerator in Shanghai https://www.yahoo.com/finance/m/12b36924-8eb7-3ad8-89a3-36ae798d1597/medtronic-launches-med-tech.html?.tsrc=fauxdal …";;@;;"1110651488248971272";https://twitter.com/yusufhameed/status/1110651488248971272
;2019-03-26 21:13;0;0;"United States Barrett’s Esophagus Ablation Devices Markets, 2019-2025 Analysis & Forecasts Featuring Medtronic, CSA Medical & Pentax http://razzletazzle.com/showbiz-rightnow/united-states-barretts-esophagus-ablation-devices-markets-2019-2025-analysis-amp-forecasts-featuring-medtronic-csa-medical-amp-pentax/2019/03/26/ …";;;;"1110650927361327104";https://twitter.com/RazzleTazzleMag/status/1110650927361327104
;2019-03-26 21:10;0;0;"Medtronic cardiac implants can be hacked, FDA issues alert https://wp.me/p120rT-1RaJ";;;;"1110650214078210048";https://twitter.com/AshtonSolutions/status/1110650214078210048
;2019-03-26 21:08;0;0;"Waters Parkerson & Company Decreased Invesco LTD Shs $ IVZ Position; Medtronic PLC. Ordinary Shares $ MDT Sellers Increased By 7.76% Their Shortshttps://finreviewer.com/2019/03/26/waters-parkerson-medtronic-plc-ordinary-shares-mdt-sellers-increased-by-7-76-their-shorts/ …";;;;"1110649820321062914";https://twitter.com/thefinreviewer/status/1110649820321062914
;2019-03-26 21:08;0;0;"As Medtronic Plc $ MDT Stock Declined, Adams Express Company Lowered by $2.73 Million Its Stake; Antero Res $ AR Shareholder Clear Harbor Asset Management Has Raised Stake by $571,977 as Share Price Declinedhttps://finreviewer.com/2019/03/26/as-medtronic-plc-mdt-stock-declined-adams-express-company-lowered-by-2-73-million-its-stake-antero-res-ar-shareholder-clear-harbor-asset-management-has-raised-stake-by-571977-as-share-price-d/ …";;;;"1110649671205224449";https://twitter.com/thefinreviewer/status/1110649671205224449
;2019-03-26 21:03;0;0;"Medtronic Inc (MDT) price at close, 2019-03-26, is 90.99. # RoboticSurgery # Stockstowatch";;;# #;"1110648445164011527";https://twitter.com/RoboSrgryInvest/status/1110648445164011527
;2019-03-26 20:45;0;2;"Medtronic Flaws Could Let Hackers Control Devices - Infosecurity Magazine https://nhbr.us/2V0keek # cybersecurity # infosec";;;# #;"1110643962497388545";https://twitter.com/NuHarbor/status/1110643962497388545
;2019-03-26 20:41;0;0;"Waters Parkerson & Company Has Cut Position in Oracle Com $ ORCL by $573,210 as Valuation Rose; As Medtronic $ MDT Stock Value Declined, Holder Westend Advisors Cut Holding https://whatsonthorold.com/2019/03/26/waters-parkerson-as-medtronic-mdt-stock-value-declined-holder-westend-advisors-cut-holding/ …";;;;"1110643048470466560";https://twitter.com/whatsonthorold2/status/1110643048470466560
;2019-03-26 20:37;0;2;"They sold the 670g very aggressively, implying that it was a revolutionary & disruptive product that would change the experience of living with T1D forever, might sell out available supplies for years, only a narrow opportunity to sign up before the rush. 670g FOMO?";;;;"1110642040872800258";https://twitter.com/JakeKushnerMD/status/1110642040872800258
;2019-03-26 20:31;0;0;"750,000 Medtronic Defibrillators Vulnerable to Hacking http://bit.ly/2UVp10z";;;;"1110640314044375041";https://twitter.com/ipd_kg/status/1110640314044375041
;2019-03-26 20:30;0;0;"Medtronic Inc $ MDT Big Money 2018 Q4 Sentiment at 1.23https://kreviewer.com/2019/03/26/medtronic-inc-nysemdt-big-money-2018-q4-sentiment-at-1-23/ …";;;;"1110640277679677441";https://twitter.com/kreviewer1/status/1110640277679677441
;2019-03-26 20:30;0;0;"Definitely alarming, but a Medtronic spokesperson stressed that while defibrillators are impacted, the issue does not affect Medtronic pacemakers or insertable cardiac monitors. https://twitter.com/kaspersky/status/1110635119914684417 …";;;;"1110640104597532677";https://twitter.com/gcaughey/status/1110640104597532677
;2019-03-26 20:29;0;2;"The findings of the study are definitely concerning as it pertains to @ Medtronic product development and support and lack of real focus on user experience. Huge miss for many in not including remote monitoring at launch as well as the boot out of looping rates.";;@;;"1110639948342939649";https://twitter.com/mikepaddock/status/1110639948342939649
;2019-03-26 20:22;0;0;"DHS Warns of Vulnerabilities in Medtronic Defibrillators - http://www.techbabbler.com/2019/03/25/dhs-warns-of-vulnerabilities-in-medtronic-defibrillators-3/ …pic.twitter.com/gmUzSvd9ko";;;;"1110638100303110144";https://twitter.com/techbabblers/status/1110638100303110144
;2019-03-26 20:20;0;1;"Thread. @ mrinal cites security threat in @ Medtronic defibrillator, @ belkin WEMO and says Internet of Trust can be built with Blockchain and distributing the responsibility. # IoTSecurity # Devicemangement # IOT See his talk to my @ StanfordCSP class here. https://youtu.be/a0RlGFg9RbU https://twitter.com/mrinal/status/1110056618551472129 …";;@ @ @ @;# # #;"1110637751353790464";https://twitter.com/sujamthe/status/1110637751353790464
;2019-03-26 20:16;0;1;"@ reneehilton30!";;@;;"1110636692820684801";https://twitter.com/PMartinezMD/status/1110636692820684801
;2019-03-26 20:02;0;0;"Potentially 750,000 # Medtronic devices including defibrillators are impacted. Successful exploitation of these # vulnerabilities could impact the intended function of the device.https://threatpost.com/medtronic-defibrillators-have-critical-flaws-warns-dhs/143068/?utm_source=twitter&utm_medium=social&utm_campaign=us_threatpost_Zt0106_organic&utm_content=sm-post&utm_term=us_twitter_organic_Zt0106_sm-post_social_threatpost …";;;# #;"1110633063791452160";https://twitter.com/PCDUE/status/1110633063791452160
;2019-03-26 20:00;12;15;"Potentially 750,000 # Medtronic devices including defibrillators are impacted. Successful exploitation of these # vulnerabilities could impact the intended function of the device. https://threatpost.com/medtronic-defibrillators-have-critical-flaws-warns-dhs/143068/?utm_source=twitter&utm_medium=social&utm_campaign=us_threatpost_Zt0106_organic&utm_content=sm-post&utm_term=us_twitter_organic_Zt0106_sm-post_social_threatpost …";;;# #;"1110632676258693120";https://twitter.com/kaspersky/status/1110632676258693120
;2019-03-26 20:00;3;3;"Medtronic cardiac implants can be hacked, FDA issues alert # infosec # infosecurity # database # datascience # data # cybersecurity # security # healthcare http://ow.ly/Y9dp30ochu6";;;# # # # # # # #;"1110632668687929345";https://twitter.com/SyndesiCompany/status/1110632668687929345
;2019-03-26 20:00;0;0;". @ US_FDA says cybersecurity vulnerabilities found in some @ Medtronic devices. http://ow.ly/CKIj30ocihQ";;@ @;;"1110632660748193794";https://twitter.com/mcknightsltcn/status/1110632660748193794
;2019-03-26 19:58;0;0;"RT @ JohnNosta FDA Warns of Cyber Risk in Medtronic ICD, CRT-D Telemetry Systems https://www.medscape.com/viewarticle/910830?src=soc_tw_share … via @ medscape # digitalhealth # cybersecurity # technology # CIO # CTO";;@ @;# # # # #;"1110632205741641735";https://twitter.com/lucasoft_co_uk/status/1110632205741641735
;2019-03-26 19:51;0;0;"Medtronic cardiac implants can be hacked, FDA issues alert https://wp.me/p120rT-1RaJ";;;;"1110630363045355520";https://twitter.com/mark97052356/status/1110630363045355520
;2019-03-26 19:49;6;9;"Women Surgeons and @ SAGES_Updates have teamed up again! you can come to the @ Medtronic women's networking event at # SAGES19 on April 4. Details below! http://ow.ly/d/8i5q";;@ @;#;"1110629767424995328";https://twitter.com/WomenSurgeons/status/1110629767424995328
;2019-03-26 19:40;0;0;"MANUFACTURING JOBS OPEN HOUSE JOB FAIR Sat April 6 11 AM - 2 PM 6800 Shinglecreek Parkway Brooklyn Center, MN # jobs # assemblers # mplspic.twitter.com/BwAdmMKXru";;;# # #;"1110627500525318144";https://twitter.com/MedtronicJobs/status/1110627500525318144
;2019-03-26 19:39;0;0;"Medtronic lancia l’acceleratore di innovazione MedTech a Shanghai https://ift.tt/2uuIGZS";;;;"1110627386117275648";https://twitter.com/broby68/status/1110627386117275648
;2019-03-26 19:37;0;0;"Certainly interesting, but needs to be compared with the current UGI capsule in operation from # Medtronic... both need a fair quantity of water consumption ahead of the procedure.";;;#;"1110626973305454592";https://twitter.com/Uk_BowelDoc/status/1110626973305454592
;2019-03-26 19:36;0;0;"Medtronic lancia l’acceleratore di innovazione MedTech a Shanghai https://ift.tt/2uuIGZS";;;;"1110626626885378050";https://twitter.com/tecnomedics/status/1110626626885378050
;2019-03-26 19:35;0;0;"great work Drew! Looks like a good conference. Enjoy!!";;;;"1110626415765000193";https://twitter.com/BryantTimo/status/1110626415765000193
;2019-03-26 19:30;0;1;"# BarómetroConSalud Omar Ishrak, CEO de @ Medtronic: Fallo grave en dispositivos cardíacos https://www.consalud.es/barometro-sanitario/barometro-negativo/omar-ishrak-fallo-grave-en-dispositivos-cardiacos_61983_102_amp.html …pic.twitter.com/FiPE7iSfD7";;@;#;"1110625093493944320";https://twitter.com/Consalud_es/status/1110625093493944320
;2019-03-26 19:28;3;34;"Proud to receice a @ pic_conference award on behalf of the @ EU_H2020 CARDIS project on cardiovascular medical devices based on # siliconphotonics. @ Medtronic @ imec_int @ TyndallInstitut @ ugentpic.twitter.com/a6TNhfFiFk";;@ @ @ @ @ @;#;"1110624475811328000";https://twitter.com/RoelBaets/status/1110624475811328000
;2019-03-26 19:25;0;1;"Congrats!";;;;"1110623784246149127";https://twitter.com/DrAidanShaw/status/1110623784246149127
;2019-03-26 19:24;0;0;"As Medtronic Plc $ MDT Stock Declined, Holder Howe & Rusling Has Cut Stake by $7.03 Million; Rhenman & Partners Asset Management Ab Increased Its Stake in Abbvie $ ABBV by $2.98 Million as Valuation Declined https://reurope.com/2019/03/26/as-medtronic-plc-mdt-stock-declined-holder-howe-rhenman-partners-asset-management-ab-increased-its-stake-in-abbvie-abbv-by-2-98-million-as-valuation-d/ …";;;;"1110623626372485121";https://twitter.com/reurope_stock/status/1110623626372485121
;2019-03-26 19:21;0;0;"As Medtronic Plc $ MDT Stock Price Declined, Holder Healthcor Management LP Lowered Position; As T Mobile Us $ TMUS Share Price Rose, Quaker Capital Investments Has Decreased Holding by $8.43 Million https://reurope.com/2019/03/26/as-medtronic-plc-mdt-stock-price-declined-holder-healthcor-management-lp-lowered-position-as-t-mobile-us-tmus-share-price-rose-quaker-capital-investments-has-decreased-holding-by-8-43-million/ …";;;;"1110622899860320259";https://twitter.com/reurope_stock/status/1110622899860320259
;2019-03-26 19:18;0;1;"When will healthcare companies like @ OxfordHealthNHS @ UnitedHealthGrp @ abbvie @ Merck @ AnthemBCBS @ ExpressScripts @ CVSHealth @ McKesson @ Medtronic @ cardinalhealth @ Cigna speak out against cruel Trump admin @ TheJusticeDept America is better than this.Affordable healthcare.Fix it!";;@ @ @ @ @ @ @ @ @ @ @ @;;"1110622056251449344";https://twitter.com/StephenJMarlin/status/1110622056251449344
;2019-03-26 19:01;2;2;"Medical IoT # hacking remains a major issue as the DHS is warning users of Medtronic defibrillators of two vulnerabilities which attackers can use to alter the devices function reports @ DougOlenick via @ SCMagazine. Read more here: http://ow.ly/s3r430ob8UC pic.twitter.com/KCQ9NdysiI";;@ @;#;"1110617814832988161";https://twitter.com/denimgroup/status/1110617814832988161
;2019-03-26 19:01;0;0;"# Cybersecurity Vulnerabilities Affecting @ Medtronic Implantable # Cardiac Devices, # Programmers, and Home Monitors: @ US_FDA # Safety Communication. # Cardiology # Physicians # Patients # Health https://www.fda.gov/MedicalDevices/Safety/AlertsandNotices/ucm633960.htm …pic.twitter.com/dySVZ9R1xn";;@ @;# # # # # # # #;"1110617744272183297";https://twitter.com/CTDmso/status/1110617744272183297
;2019-03-26 19:00;0;1;"# BarómetroConSalud Omar Ishrak, CEO de @ Medtronic: Fallo grave en dispositivos cardíacos https://www.consalud.es/barometro-sanitario/barometro-negativo/omar-ishrak-fallo-grave-en-dispositivos-cardiacos_61983_102_amp.html …pic.twitter.com/1Dahg7gWM6";;@;#;"1110617537136521216";https://twitter.com/ECSalud_com/status/1110617537136521216
;2019-03-26 18:56;0;2;"Medtronic discloses wireless cyber security flaw in several implantable cardiac devices http://bit.ly/2WnIeIH # medtronic # cybersecurity # cyberattack";;;# # #;"1110616630625792004";https://twitter.com/CyberSec_Events/status/1110616630625792004
;2019-03-26 18:56;0;3;"@ Mr_Samuel_Brown @ dmbaker13 from 1.33 - we made the cut ;)";;@ @;;"1110616538447577089";https://twitter.com/Sivesh93/status/1110616538447577089
;2019-03-26 18:55;0;0;"# Medtronic’s implantable # heart # defibrillators vulnerable to # hack https://securityaffairs.co/wordpress/82764/hacking/medtronic-heart-defibrillators-flaws.html … @ cal_csic # ucsbinfosec # ucsb # ITsecurity # cybersecurity # phishing # scams # cyberattack # cyberaware # security # tech # iot # hacker # hacking # cyber";;@;# # # # # # # # # # # # # # # # # #;"1110616377092526080";https://twitter.com/UCSB_ITSECURITY/status/1110616377092526080
;2019-03-26 18:51;0;0;"Medtronic cardiac implants can be hacked, U.S. Food and Drug Administration issues alert https://nakedsecurity.sophos.com/2019/03/25/medtronic-cardiac-implants-can-be-hacked-fda-issues-alert …";;;;"1110615336917725185";https://twitter.com/MAJESTARCC/status/1110615336917725185
;2019-03-26 18:47;0;0;"Medtronic cardiac implants can be hacked, FDA issues alert https://wp.me/p120rT-1RaJ";;;;"1110614288539021318";https://twitter.com/jaydee32/status/1110614288539021318
;2019-03-26 18:46;0;0;"RT: CVE-2019-6540 The Conexus telemetry protocol utilized within Medtronic MyCareLink Monitor versions 24950 and 24952, CareLink Monitor version 2490C, CareLink 2090 Programmer, Amplia CRT-D, Claria CRT-D, Compia CRT-D, Concerto CRT-D, Concerto II CRT-D, Co... …";;;;"1110614032963256320";https://twitter.com/SecRiskRptSME/status/1110614032963256320
;2019-03-26 18:46;0;0;"CVE-2019-6540 The Conexus telemetry protocol utilized within Medtronic MyCareLink Monitor versions 24950 and 24952, CareLink Monitor version 2490C, CareLink 2090 Programmer, Amplia CRT-D, Claria CRT-D, Compia CRT-D, Concerto CRT-D, Concerto II CRT-D, Co.… https://cve.mitre.org/cgi-bin/cvename.cgi?name=CVE-2019-6540 …";;;;"1110613995210395648";https://twitter.com/eyeTSystems/status/1110613995210395648
;2019-03-26 18:45;0;1;"CVE-2019-6540 The Conexus telemetry protocol utilized within Medtronic MyCareLink Monitor versions 24950 and 24952, CareLink Monitor version 2490C, CareLink 2090 Programmer, Amplia CRT-D, Claria CRT-D, Compia CRT-D, Concerto CRT-D, Concerto II CRT-D, Co... https://cve.mitre.org/cgi-bin/cvename.cgi?name=CVE-2019-6540 …";;;;"1110613714359775232";https://twitter.com/CVEnew/status/1110613714359775232
;2019-03-26 18:43;0;0;"The Department of Homeland Security has issued an emergency alert warning of critical flaws allowing attackers to tamper with several Medtronic medical devices, including defibrillators. http://bit.ly/2HDMmRB";;;;"1110613279750217734";https://twitter.com/HighCastleCyber/status/1110613279750217734
;2019-03-26 18:30;0;1;"Learn more about the Chocolate PTA balloon. View its six key features and more here: http://bit.ly/2TZs0J7 pic.twitter.com/80mtTXGPiU";;;;"1110609916669161473";https://twitter.com/MedtronicAPV/status/1110609916669161473
;2019-03-26 18:25;1;0;"Medtronic’s insulin system proves tricky for younger patients - http://ow.ly/uVQA30octIM via @ Vantageanalysis @ LizVantage $ MDT # diabetes # medtechpic.twitter.com/jTG0fKxiSi";;@ @;# #;"1110608620666933250";https://twitter.com/evaluatepharma/status/1110608620666933250
;2019-03-26 18:22;0;0;"DHS Warns of Vulnerabilities in Medtronic Defibrillators - http://www.techbabbler.com/2019/03/25/dhs-warns-of-vulnerabilities-in-medtronic-defibrillators-3/ …pic.twitter.com/1UmQAQqcG1";;;;"1110607909228941313";https://twitter.com/techbabblers/status/1110607909228941313
;2019-03-26 18:21;0;0;"U.S. Next Generation Diabetes Therapy and Drug Delivery Market 2019 will Boom By Key Players Abbott Laboratories, Echo Therapeutics, F. Hoffmann-La Roche Ltd., GlySens Incorporated, Medtronic, Sanofi, Novo Nordisk, MannKind Corporation, Dexcom http://www.total-pharma-news.com/news/u-s-next-generation-diabetes-therapy-and-drug-delivery-market-2019-will-boom-by-key-players-abbott-laboratories-echo-therapeutics-f-hoffmann-la-roche-ltd-glysens-incorporated-medtronic-sanofi-novo-nordisk-mannkind-corporation-dexcom-2151206 …";;;;"1110607664915103745";https://twitter.com/total_pharma/status/1110607664915103745
;2019-03-26 18:20;0;0;"Medtronic cardiac implants can be hacked, FDA issues alert https://wp.me/p120rT-1RaJ";;;;"1110607383472988160";https://twitter.com/Lichen__zhang/status/1110607383472988160
;2019-03-26 18:05;0;0;". @ Medtronic launches Shanghai-based # medtech # incubatorhttp://ow.ly/aPF630ociQx";;@;# #;"1110603588924071937";https://twitter.com/MassDevice/status/1110603588924071937
;2019-03-26 18:04;0;0;"I'm sorry to hear this, Angela. It sounds like you're in the UK and you've reached the US team. We're not aware of any pump software issue, but we encourage you to continue working with your local UK team for any updates.";;;;"1110603353896177665";https://twitter.com/MDT_Diabetes/status/1110603353896177665
;2019-03-26 18:03;1;2;"I'm sorry for any inconvenience, Hallie. Our supply team can go over your available options. Please email our team your contact info to dhelp@medtronic.com and a team member will be in touch.";;@medtronic;;"1110603225609187328";https://twitter.com/MDT_Diabetes/status/1110603225609187328
;2019-03-26 17:56;0;0;"Can you please ask your friend if the rechargeable battery is interchangeable with the standard Medtronic battery 37601. Thank you";;;;"1110601546486726656";https://twitter.com/cdhead1969/status/1110601546486726656
;2019-03-26 17:42;1;9;"Proud to be @ SIRspecialists # Intnl scholars # hackathon with @ angiowoman @ EmoryIRad @ jayshahtweets @ bsc_pi @ MeritMedical @ Medtronic @ CookMedical Solutions for International Health and IRpic.twitter.com/jyJYEPy2tw";;@ @ @ @ @ @ @ @;# #;"1110597841754443776";https://twitter.com/JiggleMed/status/1110597841754443776
;2019-03-26 17:35;0;0;"We'll certainly look into the possibility of adding infusion sets and devices to this process as well. If you have any questions about our online replacement program, please give our team a call at 800.646.4633, option 1.";;;;"1110596178142478337";https://twitter.com/MDT_Diabetes/status/1110596178142478337
;2019-03-26 17:35;0;0;"Thanks for reaching out, Emily. Sensor replacements can be requested on our website, by logging in to your online account. (more)";;;;"1110596115181830144";https://twitter.com/MDT_Diabetes/status/1110596115181830144
;2019-03-26 17:34;0;0;"Holder Donaldson Capital Management Boosted Medtronic Plc Shs $ MDT Holding; Dominion Midstream LP $ DM Holder A-D-Beadell Investment Counsel Has Decreased Stake by $1.27 Million as Share Value Were Volatilehttps://whatsonthorold.com/2019/03/26/holder-donaldson-capital-management-boosted-medtronic-plc-shs-mdt-holding-dominion-midstream-lp-dm-holder-a-d-beadell-investment-counsel-has-decreased-stake-by-1-27-million-as-share-value-were-v/ …";;;;"1110595829595885569";https://twitter.com/whatsonthorold2/status/1110595829595885569
;2019-03-26 17:31;0;0;"Medtronic cardiac implants can be hacked, FDA issues alert http://bit.ly/2CGd9s8";;;;"1110595101695377409";https://twitter.com/Jedi443/status/1110595101695377409
;2019-03-26 17:25;0;2;"this is the thing that puts me off about Medtronic it is so ugly well the 640 anyway! not seen new pump etc";;;;"1110593571772657665";https://twitter.com/LwSweetpea88/status/1110593571772657665
;2019-03-26 17:22;0;0;"Medtronic: Investment 'Trifecta' Could Result In Outstanding Returns - Seeking Alpha http://dlvr.it/R1bNz0";;;;"1110592890542002176";https://twitter.com/WorldIFnews/status/1110592890542002176
;2019-03-26 17:19;0;0;"Des chercheurs ont identifié des vulnérabilités dans le système de communication de défibrillateurs cardiaques produits par Medtronic. Des hackers pourraient en manipuler le fonctionnement à distance. https://bit.ly/2TvoAbC # bemore # IT # medicaltechnologypic.twitter.com/j8VGK829lc";;;# # #;"1110592047122206720";https://twitter.com/BemoreHolding/status/1110592047122206720
;2019-03-26 17:17;0;0;"Hi Jay. We are still experiencing a backorder on test plugs, but please know we will have yours shipped as soon as inventory becomes available.";;;;"1110591635228975105";https://twitter.com/MDT_Diabetes/status/1110591635228975105
;2019-03-26 17:10;0;0;"Livingston Group Asset Management Southport Capital Management Boosted Medtronic $ MDT Stake; As Churchill Downs Com $ CHDN Stock Value Declined, Shareholder Argi Investment Services Has Lowered Its Holding by $364,500https://reurope.com/2019/03/26/livingston-group-asset-management-southport-capital-management-boosted-medtronic-mdt-stake-as-churchill-downs-com-chdn-stock-value-declined-shareholder-argi-investment-services-has-lowered-its/ …";;;;"1110589764284108800";https://twitter.com/reurope_stock/status/1110589764284108800
;2019-03-26 17:07;0;0;"Respectfully, it is hideous. I refused to look at that monstrosity. It would kill my body confidence & I would wall myself in. I Medtronic were so dishonest & slow when I was pregnant (32w wait for the pump & CGM) I had 0 patience.";;;;"1110589100640350209";https://twitter.com/SuperChowChow/status/1110589100640350209
;2019-03-26 17:04;4;13;"Le # congrès # SFD2019 ouvre ses portes aujourd'hui. Innovations, réalité virtuelle, santé connectée... L’équipe # Diabète est présente et vous accueille sur le stand 23 pour échanger et construire ensemble la diabétologie de demain. # oculusgo # Hypoglycémie # Esante # technologiepic.twitter.com/8OyTemYde1";;;# # # # # # #;"1110588303009636352";https://twitter.com/MedtronicFR/status/1110588303009636352
;2019-03-26 16:59;0;4;"We spy a familiar face! Congratulations to our first Women in Health Leadership speaker, @ Medtronic’s Ravyn Miller, on this honor! # WomenInSTEMhttps://twitter.com/MSPBJnews/status/1110579981174915072 …";;@;#;"1110587059218075649";https://twitter.com/MedicalAlley/status/1110587059218075649
;2019-03-26 16:58;0;0;"I used to be Medtronic but now I’m Omni with no wires anymore";;;;"1110586857098756096";https://twitter.com/GreaseFactory16/status/1110586857098756096
;2019-03-26 16:57;0;0;"Medtronic all day";;;;"1110586687850250241";https://twitter.com/NewEra716/status/1110586687850250241
;2019-03-26 16:57;0;0;"Medtronic discloses wireless cybersecurity flaw in several implantable cardiac devices - FierceBiotech https://ift.tt/2TwjZ9m RT @ kcaindec";;@;;"1110586589791412224";https://twitter.com/btcnasia/status/1110586589791412224
