username;date;retweets;favorites;text;geo;mentions;hashtags;id;permalink
;2019-03-28 11:04;0;0;"Hemorrhoid Therapy Devices Market Overview 2019 by Companies Medtronic, Johnson & Johnson, Surkon Medical - The Market Research News http://www.total-pharma-news.com/news/hemorrhoid-therapy-devices-market-overview-2019-by-companies-medtronic-johnson-johnson-surkon-medical-the-market-research-news-2159258 …";;;;"1111222473213792256";https://twitter.com/total_pharma/status/1111222473213792256
;2019-03-28 11:03;7;16;"Cerrahpaşa Cerrahi Toplantıları kapsamında TOSS 4. Kış Okulu başladı. 100’ e yakın hekimin katılımıyla gerçekleştirilen bu etkinlikte, obezite ve metabolik cerrahide revizyonel cerrahi teknikleri naklen canlı ameliyat yayınları ile pekiştiriliyor # medikalcihaz # medikalteknolojipic.twitter.com/ctDIE9suw9";;;# #;"1111222151779180545";https://twitter.com/MedtronicTR/status/1111222151779180545
;2019-03-28 10:51;0;1;"Ppl $ PPL Stake Has Boosted by Fukoku Mutual Life Insurance Company; As Medtronic Plc $ MDT Market Valuation Declined, Holder Jnba Financial Advisors Has Boosted Stake https://whatsonthorold.com/2019/03/28/ppl-ppl-stake-has-boosted-by-fukoku-mutual-life-insurance-company-as-medtronic-plc-mdt-market-valuation-declined-holder-jnba-financial-advisors-has-boosted-stake/ …";;;;"1111219150729420800";https://twitter.com/whatsonthorold2/status/1111219150729420800
;2019-03-28 10:41;1;0;"Hundreds of Thousands of Medtronic Defibrillators Could Be Vulnerable to Hacking Due to Flaw - Gizmodo UK https://ift.tt/2CHjC6i";;;;"1111216702170238976";https://twitter.com/AnonLive/status/1111216702170238976
;2019-03-28 10:39;0;0;"Desfibriladores implantables de Medtronic vulnerables a 2 fallos de seguridad que podrían afectar a los pacientes https://unaaldia.hispasec.com/2019/03/desfibriladores-implantables-de-medtronic-vulnerables-a-2-fallos-de-seguridad-que-podrian-afectar-a-los-pacientes.html …";;;;"1111216206588141568";https://twitter.com/Sociabilidad/status/1111216206588141568
;2019-03-28 10:37;0;0;"# infosec # hacking Desfibriladores implantables de Medtronic vulnerables a 2 fallos de seguridad que podrían afectar a los pacientes https://ift.tt/2Og3aN5";;;# #;"1111215747160858624";https://twitter.com/juncotic/status/1111215747160858624
;2019-03-28 10:36;14;8;"Desfibriladores implantables de Medtronic vulnerables a 2 fallos de seguridad que podrían afectar a los pacientes https://unaaldia.hispasec.com/2019/03/desfibriladores-implantables-de-medtronic-vulnerables-a-2-fallos-de-seguridad-que-podrian-afectar-a-los-pacientes.html …pic.twitter.com/vhPnzC9FM8";;;;"1111215583742357504";https://twitter.com/unaaldia/status/1111215583742357504
;2019-03-28 10:26;0;0;"Atalanta Sosnoff Capital Has Raised Medtronic Plc $ MDT Position; iRobot $ IRBT Covered By 0 Bullshttps://finheadlines.com/2019/03/28/atalanta-sosnoff-capital-has-raised-medtronic-plc-mdt-position-irobot-irbt-covered-by-0-bulls/ …";;;;"1111212942563905536";https://twitter.com/HeadlinesFin/status/1111212942563905536
;2019-03-28 10:25;0;0;"Birthday boy @Medtronic Waterfall Distribution Campus https://www.instagram.com/p/BvjGoCvnnaWDCEflXL6eFN_3D9vwnJ387etNqs0/?utm_source=ig_twitter_share&igshid=12gatzgemk1zv …";;@Medtronic;;"1111212805141786624";https://twitter.com/SanyanaMahlangu/status/1111212805141786624
;2019-03-28 10:25;0;0;"Medtronic Plc $ MDT Shareholder Voya Investment Management Has Increased Position by $58.13 Million as Stock Value Declined; Herbalife Nutrition LTD $ HLF Holder Eagle Boston Investment Management Decreased Its Holding by $9.90 Millionhttps://reurope.com/2019/03/28/medtronic-plc-mdt-shareholder-voya-investment-management-has-increased-position-by-58-13-million-as-stock-value-declined-herbalife-nutrition-ltd-hlf-holder-eagle-boston-investment-management-dec/ …";;;;"1111212678448582656";https://twitter.com/reurope_stock/status/1111212678448582656
;2019-03-28 10:24;0;0;"@ MedtronicCEO I am Dr saleem shaikh @ onyxint Cardiologist & CEO Onyx international Pakistan. We are interested in Medtronic";;@ @;;"1111212534395215878";https://twitter.com/onyxint/status/1111212534395215878
;2019-03-28 10:19;1;3;"Las alianzas aportan las soluciones integradas necesarias para resolver los problemas de # salud y del sistema sanitario. En Medtronic apostamos por el valor que somos capaces de crear, en colaboración con otros, al # Paciente. # RetosCEOpic.twitter.com/LgEbJuBy66";;;# # #;"1111211231996715010";https://twitter.com/MedtronicES/status/1111211231996715010
;2019-03-28 10:15;3;4;"Venez soutenir le @ CHUAmiens en lice pour la catégorie innovation fournisseur pour son diaglogue compétitif en neurochirurgie de l’excellent Dr @ lefrancmi et son équipe avec @ Medtronic et Alexandre Jaborska # innovationmondiale # neurochirurgie # patient # SimuSantéhttps://twitter.com/decision_achats/status/1106117379354959872 …";;@ @ @;# # # #;"1111210146204659714";https://twitter.com/Magali_Tassery/status/1111210146204659714
;2019-03-28 10:07;0;0;"Centre Asset Management Raised Medtronic Plc $ MDT Holding by $2.30 Million; Stock Declined; Cedar Hill Associates Lifted Its Tortoise Energy Infra Com $ TYG Stake by $551,570https://www.mmahotstuff.com/2019/03/28/centre-asset-management-raised-medtronic-plc-mdt-holding-by-2-30-million-stock-declined-cedar-hill-associates-lifted-its-tortoise-energy-infra-com-tyg-stake-by-551570.html …";;;;"1111208063799906309";https://twitter.com/mmahotstuff1/status/1111208063799906309
;2019-03-28 10:05;0;0;"Medtronic's Implantable Defibrillators Vulnerable to Life-Threatening Hacks https://buff.ly/2U7FqSg";;;;"1111207551633448960";https://twitter.com/LiorDolphin/status/1111207551633448960
;2019-03-28 10:03;0;0;"Chevron New $ CVX Stock Rose While First Republic Investment Management Has Decreased by $10.02 Million Its Position; Medtronic Plc Shs $ MDT Holder Cutler Investment Counsel Boosted Position https://finexaminer.com/2019/03/28/chevron-new-cvx-stock-rose-while-first-republic-investment-management-has-decreased-by-10-02-million-its-position-medtronic-plc-shs-mdt-holder-cutler-investment-counsel-boosted-position/ …";;;;"1111207210863001601";https://twitter.com/thefinreviewer/status/1111207210863001601
;2019-03-28 10:00;1;0;"“La monitorización remota es un ejemplo de innovación y digitalización en la tecnología sanitaria que aporta numerosos beneficios tanto a pacientes como al sistema” María Vila en # RetosCEOpic.twitter.com/cAvBuvWlOn";;;#;"1111206477488971776";https://twitter.com/MedtronicES/status/1111206477488971776
;2019-03-28 09:53;1;3;"María Vila, nuestra presidenta, apunta a la responsabilidad de adaptar los objetivos globales de las empresas a las necesidades locales, como es el acceso a la # TecnologíaSanitaria # RetosCEOpic.twitter.com/OWBFoS9Pza";;;# #;"1111204727595896832";https://twitter.com/MedtronicES/status/1111204727595896832
;2019-03-28 09:52;1;2;"Lavorare in # MedtronicItalia? Una carriera che cambia la vita. Siamo felici di aver partecipato ieri a Medtech Day, primo evento @ Jobadvisor in cui aziende di tecnologie mediche incontrano studenti, laureandi e laureati in ingegneria biomedicale e discipline affini.pic.twitter.com/OAjYmEnS7K";;@;#;"1111204412037447680";https://twitter.com/MedtronicITA/status/1111204412037447680
;2019-03-28 09:47;1;3;"Empieza el segundo panel de # RetosCEO en el que se habla de los modelos de responsabilidad compartida entre sociedad y empresa, con foco en la # salud y el desarrollo con @ Fundacion_SERES @ MAPFRE @ pfizer_spain y Medtronic pic.twitter.com/xKxnaVOOAd";;@ @ @;# #;"1111203025228627969";https://twitter.com/MedtronicES/status/1111203025228627969
;2019-03-28 09:43;4;6;"[ # JNN2019] Ouverture des Journées Nationales de Néonatologie. Notre équipe RMS - partenaire de l'événement- est présente pour échanger et discuter avec les différents acteurs de nouvelles approches du dépistage postnatal des # cardiopathiesCongénitales. # PartageDexperience # Santépic.twitter.com/hhWFmA0wDY";;;# # # #;"1111202144718389248";https://twitter.com/MedtronicFR/status/1111202144718389248
;2019-03-28 09:42;0;1;"Medtronic cardiac implants can be hacked, FDA issues alert https://twi.li/Dupgq1 # MedTech # security # data # privacypic.twitter.com/ntYJ7BgNTw";;;# # # #;"1111201770829762566";https://twitter.com/hubermantamir/status/1111201770829762566
;2019-03-28 09:30;0;0;"Global First Aid Tapes Market 2019 – 3M, Band-Aid, Johnson & Johnson, RockTape, Smith & Nephew, Medtronic http://www.total-pharma-news.com/news/global-first-aid-tapes-market-2019-3m-band-aid-johnson-johnson-rocktape-smith-nephew-medtronic-2158990 …";;;;"1111198855473840129";https://twitter.com/total_pharma/status/1111198855473840129
;2019-03-28 09:26;0;1;"Piratage : une faille de sécurité dans des défibrillateurs implantables Medtronic https://www.pourquoidocteur.fr/Articles/Question-d-actu/28674-Piratage-faille-securite-defibrillateurs-implantables-Medtronic?fbclid=IwAR3C0vXSXkImK04x17bu2GYwU-xn4YNDpjhLM6etp1t8zMs47Gc5p-7hxu4 …pic.twitter.com/fIjS5LjNYr";;;;"1111197816506990592";https://twitter.com/Pourquoidocteur/status/1111197816506990592
;2019-03-28 09:11;3;6;"Excelente panel CEOs: Digitalización & Valores: Antonio Brufao (Repsol), Francisco Román (F. Seres), J.A. López (Ericsson), Juan Orti (American Express), Marta Martínez (IBM), Sergio Rofríguez (Pfizer), José Manuel Inchausti (Mapfre), Marta Vila Medtronic)⁦ @ APDasociacion⁩pic.twitter.com/G9tNlCBYnb";;@;;"1111194015590989824";https://twitter.com/AlexPolacc/status/1111194015590989824
;2019-03-28 09:10;7;6;"El primer panel de # RetosCEO apunta a los valores, la responsabilidad, la educación y la # diversidad como elementos fundamentales en la tranformación digital que estamos viviendopic.twitter.com/Pm7EiO777S";;;# #;"1111193721083711488";https://twitter.com/MedtronicES/status/1111193721083711488
;2019-03-28 09:08;1;0;"Fresher Job Alert - Medtronic Recruitment | Field Sales Trainee | BE /B.Tech (Any discipline)|Karnataka| Last Date:ASAP Apply Now - https://buff.ly/2FD4qsU # job # Hiring # CareerArc # TweetMyJobs # jobsearch # jobs4u # freshers # jobspic.twitter.com/UYBzrOj5PI";;;# # # # # # # #;"1111193212331409408";https://twitter.com/Freshervacancy/status/1111193212331409408
;2019-03-28 09:00;0;0;""Conexus Radio Frequency Telemetry Protocol (Medtronic's proprietary means for the monitors to wirelessly connect to implanted devices) provides no encryption to secure communications" https://lnkd.in/dATb5jq";;;;"1111191215783989248";https://twitter.com/connectjunkie/status/1111191215783989248
;2019-03-28 08:46;4;9;"Empieza el encuentro # RetosCEO donde vamos a compartir, debatir y aprender sobre los nuevos modelos de negocio tecnológicos y responsables y las estrategias para diseñar un futuro más sostenibepic.twitter.com/Qh49Ims8pA";;;#;"1111187875721293825";https://twitter.com/MedtronicES/status/1111187875721293825
;2019-03-28 08:23;0;0;"Une faille de sécurité dans des défibrillateurs implantables Medtronic | @ scoopithttp://sco.lt/4nrXwu";;@;;"1111182008154247168";https://twitter.com/RECIPRO_Rh/status/1111182008154247168
;2019-03-28 08:14;0;0;"Comparing Medtronic $ MDT and Fonar $ FONRhttp://thelincolnianonline.com/?p=2801938";;;;"1111179665392259074";https://twitter.com/ThisLincolnian/status/1111179665392259074
;2019-03-28 08:07;0;0;"Piratage : une faille de sécurité dans des défibrillateurs implantables Medtronic https://www.handi-zen.com/piratage-une-faille-de-securite-dans-des-defibrillateurs-implantables-medtronic …";;;;"1111178090305196038";https://twitter.com/chrishandizen/status/1111178090305196038
;2019-03-28 07:57;1;0;"U.S. Thrombectomy Devices Market 2023 Get Sample Report - https://bit.ly/2Wvuxrg # kdmarketinsights # markets # marketresearch # healthcare # US # lifescience @ BSCCardioAPAC @ Medtronic @ TeleflexInc @ penumbraincpic.twitter.com/0qLN49UdNx";;@ @ @ @;# # # # # #;"1111175357976244224";https://twitter.com/AshiAga63811094/status/1111175357976244224
;2019-03-28 07:22;0;0;"RT @ RonitRo32956090: Over $968.5 million, # Trocars # market - 2024, Ethicon Inc. (J&J), @ Medtronic and Applied Medical Resources Corporation are the leading players in the global market http://bit.ly/2HXJVZs # gynecologist # surgery # healthcare # medica…pic.twitter.com/6oHM4OgMJS";;@ @;# # # # # #;"1111166597962465280";https://twitter.com/TV_HIEC_Chair/status/1111166597962465280
;2019-03-28 07:08;0;1;"Over $968.5 million, # Trocars # market - 2024, Ethicon Inc. (J&J), @ Medtronic and Applied Medical Resources Corporation are the leading players in the global market http://bit.ly/2HXJVZs # gynecologist # surgery # healthcare # medicaldevice # research # medicaldevices # hospital pic.twitter.com/mHDPL9sX1I";;@;# # # # # # # # #;"1111163147614773248";https://twitter.com/RonitRo32956090/status/1111163147614773248
;2019-03-28 05:40;3;9;"Doing a little bit of self-experimentation. Comparing the ‘Guardian connect’ by Medtronic vs ‘Freestyle Libre’ (the international version, not Libre pro) with background use of Glucometer for accuracy and convenience of use. Watch this space. # Endotwitter # ENDO2019pic.twitter.com/Kr3tKvCBY5";;;# #;"1111140981301075968";https://twitter.com/omlakhani/status/1111140981301075968
;2019-03-28 04:32;0;0;"$ TGRO .0009 at 52 week low. Had 162 million on the 0013 bid 2 days ago. Below is a picture of when there was significally less on the bid but still over 100 million. Get ready for the fireworks tomorrow $ SING $ IDVV $ ONCI $ VYST $ VSTR $ DKGR $ RSHN $ MRNJ $ VFF $ SNMN $ FNMA $ IPIX $ HMPQpic.twitter.com/b7oGoQJahl";;;;"1111123786148003840";https://twitter.com/aaaamhim/status/1111123786148003840
;2019-03-28 03:59;0;0;"Alongside a safety notice from the FDA, Medtronic has disclosed a potential cyber-hacking vulnerability in a number of its implantable cardiac devices, including defibrillators https://www.fiercebiotech.com/medtech/medtronic-discloses-wireless-cybersecurity-flaw-several-implantable-cardiac-devices?mkt_tok=eyJpIjoiWXpkalpEazVZakUwTkdRMSIsInQiOiJGTEQ5dFRyejRnRFp4S205aTJLMjErTHBqdU5wTXVNNWRBR0JJSFdqQ1Q4RWxqQWxqME1TZHBXeTNrdFNNeUtuWm5ucjNJWUJMMlE1SGpOdHRidVwvaFI1YXNKWUxiMituVDJrODhiYW5vbHhaa1AwQUQwWjg3QUh2NXArMGF6WkcifQ%3D%3D&mrkid=73827811&utm_medium=nl&utm_source=internal … RT @ MoBetterNews";;@;;"1111115544063688707";https://twitter.com/btcnasia/status/1111115544063688707
;2019-03-28 03:48;3;10;"Today officially marks the beginning of our # Reconciliation Action Plan. Thanks our great speakers for joining us today! @ WDNWPT @ RecAustraliapic.twitter.com/sEnibVzB1k";;@ @;#;"1111112704603770881";https://twitter.com/MedtronicANZ/status/1111112704603770881
;2019-03-28 03:44;0;1;"Alongside a safety notice from the FDA, Medtronic has disclosed a potential cyber-hacking vulnerability in a number of its implantable cardiac devices, including defibrillators https://www.fiercebiotech.com/medtech/medtronic-discloses-wireless-cybersecurity-flaw-several-implantable-cardiac-devices?mkt_tok=eyJpIjoiWXpkalpEazVZakUwTkdRMSIsInQiOiJGTEQ5dFRyejRnRFp4S205aTJLMjErTHBqdU5wTXVNNWRBR0JJSFdqQ1Q4RWxqQWxqME1TZHBXeTNrdFNNeUtuWm5ucjNJWUJMMlE1SGpOdHRidVwvaFI1YXNKWUxiMituVDJrODhiYW5vbHhaa1AwQUQwWjg3QUh2NXArMGF6WkcifQ%3D%3D&mrkid=73827811&utm_medium=nl&utm_source=internal …";;;;"1111111849360142336";https://twitter.com/MoBetterNews/status/1111111849360142336
;2019-03-28 03:40;0;1;"thank you! as it’s a 630g medtronic! i’ve been trying to upgrade to the 670. how do you like it?";;;;"1111110670089637888";https://twitter.com/mentally_chilll/status/1111110670089637888
;2019-03-28 03:35;0;2;"Is that a mio? I have a 670 Medtronic! Don’t let anyone put you down about whatever. You’re beautiful and always will be!";;;;"1111109588051464192";https://twitter.com/evanrussell67/status/1111109588051464192
;2019-03-28 03:30;0;0;"RE: MINIMED 670G, EL "PáNCREAS ARTIFICIAL" ¿Sabéis si ya están dando en la SEguridad Social la minimed 670G? He visto en internet en la página de Medtronic que ya está disponible en España... Leer más http://bit.ly/2CEIHP8 # diabetes # diabetESPpic.twitter.com/qLlPZuUUNI";;;# #;"1111108158905307136";https://twitter.com/diabetesforo/status/1111108158905307136
;2019-03-28 03:15;1;0;"The FDA recently disclosed a vulnerability in Medtronic Plc’s implantable cardiac devices, clinic programmers, and home monitors. Details here: @ Reuters # cybersecurity # healthcare http://bit.ly/2CIBPQL pic.twitter.com/2zr7Xlmjg9";;@;# #;"1111104504219340800";https://twitter.com/ithobbit/status/1111104504219340800
;2019-03-28 03:10;5;9;"Be the best accessorized # Engineer @ # NSBE45 with your very own Running Belt / Fanny Pack from @ MedtronicJobs, Booth #333, and go Further, Together, with Medtronic. pic.twitter.com/rYSKXae12b – bei Cobo Center";;@ @;# # #333;"1111103146158424064";https://twitter.com/steffenson/status/1111103146158424064
;2019-03-28 03:10;0;0;"The FDA recently disclosed a vulnerability in Medtronic Plc’s implantable cardiac devices, clinic programmers, and home monitors. Details here: @ Reuters # cybersecurity # healthcare http://bit.ly/2CIJ0IP pic.twitter.com/HeJ4nRWz4k";;@;# #;"1111103115124604928";https://twitter.com/brunogoveas/status/1111103115124604928
;2019-03-28 03:01;0;0;"I just registered for Medtronic Twin Cities Marathon Weekend 2019 using Race Roster. Join me - https://raceroster.com/events/2019/18454/medtronic-twin-cities-marathon-weekend-2019?aff=KFNQ5 …";;;;"1111100930299179008";https://twitter.com/zhangzhen3/status/1111100930299179008
;2019-03-28 03:00;0;0;"@ Medtronic & # HarvardBusinessReview explores how # AI can increase productivity by automating labour-intensive & inefficient admin tasks. This allows healthcare professionals to devote more time to patients & focus on meeting their needs more efficiently.https://www.medtronic.com/us-en/transforming-healthcare/healthcare-insights/articles/article2.html …";;@;# #;"1111100685486092288";https://twitter.com/GetzHealthcare/status/1111100685486092288
;2019-03-28 02:31;0;0;"Medtronic Flaws Could Let Hackers Control Devices http://dlvr.it/R1hPN9 pic.twitter.com/d9Ew08BLRv";;;;"1111093309231910912";https://twitter.com/BeccaInfosecMag/status/1111093309231910912
;2019-03-28 02:24;0;0;"Homeland Security warns of critical flaws in Medtronic defibrillators http://dlvr.it/R1hNb8 pic.twitter.com/QQv4JG4zEB";;;;"1111091548710559745";https://twitter.com/benedictbacayon/status/1111091548710559745
;2019-03-28 02:05;1;6;"Our recruiting team is excited to meet you at tomorrow’s # NSBE45 career fair. We have opportunities for individuals excited to work with highly visible, impactful engineering teams. Stop by booth 333 and introduce yourself. # ExploreEngineerElevate # CareersThatChangeLivespic.twitter.com/FuDHRI9wrs";;;# # #;"1111086778658840576";https://twitter.com/MedtronicJobs/status/1111086778658840576
;2019-03-28 01:55;0;1;"Take a look at what @ TandemDiabetes has in the works with Control IQ...also read the recent study that showed most people stopped using the auto mode on the Medtronic.";;@;;"1111084355043164161";https://twitter.com/eml210/status/1111084355043164161
;2019-03-28 01:40;0;0;"Health News: # FDA says cybersecurity vulnerabilities found in some # Medtronic devices. # Reuters:http://ht.ly/U3gw30ocMLV";;;# # #;"1111080486129029120";https://twitter.com/LS_HelpID/status/1111080486129029120
;2019-03-28 01:39;0;0;"Hundreds of Thousands of Medtronic Defibrillators Could Be Vulnerable to Hacking Due to Flaw https://goo.gl/9qP8Eu";;;;"1111080450058084358";https://twitter.com/GadgetMondo/status/1111080450058084358
;2019-03-28 01:37;0;0;"Check out what I'm selling on letgo! - MEDTRONIC INSULIN PUMP https://letgo.onelink.me/O2PG/d8f1176b";;;;"1111079866345160704";https://twitter.com/samsonknight/status/1111079866345160704
;2019-03-28 01:23;0;0;"OKCAACN is able to host events like the 3rd Annual Spring Symposium because of amazing Vendor Support! Big Thanks to Medtronic/Covidien, Zoll, Alexion Pharmaceuticals, Cheetah Medical,… https://www.instagram.com/p/BviI3jdB3Z4/?utm_source=ig_twitter_share&igshid=pfl0o2gf6gw6 …";;;;"1111076304454078464";https://twitter.com/okcaacn/status/1111076304454078464
;2019-03-28 01:15;1;3;""Inclusion & Diversity: Rooted In The Mission. Embedded In The Culture. Fulfilled Through Employees," Day 2 Morning General Session with presenters Omar Ishrak and Carol Surface of @ Medtronic, moderator @ elcinfo Skip Spriggspic.twitter.com/erQ3Z6x192";;@ @;;"1111074173403758593";https://twitter.com/WorkplaceForum/status/1111074173403758593
;2019-03-28 01:00;0;0;"Medtronic’s implantable heart defibrillators vulnerable to hack http://dlvr.it/R1hD6p pic.twitter.com/eYjTrxy4xW";;;;"1111070537965395968";https://twitter.com/Cloud_Solutionz/status/1111070537965395968
;2019-03-28 00:39;0;0;"Just had a transmitter failure on day 2. Have to tear out the sensor and reset the whole system. I’m done. Add me to the list of people quitting Medtronic forever.";;;;"1111065259698085888";https://twitter.com/pkingdesign/status/1111065259698085888
;2019-03-28 00:37;0;0;"Used MEDTRONIC INSULIN PUMP for sale in Patchogue - letgo https://letgo.onelink.me/O2PG/d7982754";;;;"1111064661573713920";https://twitter.com/samsonknight/status/1111064661573713920
;2019-03-28 00:14;6;8;"This appears to cover my # Deep # Brain # Stimulation # Medtronic recalled brain implant. It is still embedded in my brain. That said it was reverseable on their website in 2015 but no one wants to take it out yet. I will find someone to remove. Please RT! pic.twitter.com/L50aI5Uu62";;;# # # #;"1111058928492793858";https://twitter.com/Terri27903773/status/1111058928492793858
;2019-03-28 00:02;0;0;"Medtronic Launches Medtech Innovation Accelerator in Shanghai https://buff.ly/2URcMCk";;;;"1111055804965228544";https://twitter.com/dentalentrepre/status/1111055804965228544
;2019-03-27 23:52;4;5;"Kicking off # NSBE45 with a bang - a panel of Medtronic VPs and a candidate dinner to meet some amazing # Engineers. # CareersThatChangeLivespic.twitter.com/GxNsCaP6K3";;;# # #;"1111053483451600898";https://twitter.com/steffenson/status/1111053483451600898
;2019-03-27 23:41;0;0;"Hundreds of Thousands of Medtronic Defibrillators Could Be Vulnerable to Hacking Due to Flaw https://ift.tt/2CHjC6i";;;;"1111050563662372864";https://twitter.com/GizmodoUK/status/1111050563662372864
;2019-03-27 23:29;1;1;"@ jtrauring it's great to see that the PR team at Medtronic takes time to refresh and continue training their employees on different situations that could happen and how they will deal with them so that they're well prepared! # comm385 @ MetroPRMajors";;@ @;#;"1111047742913241090";https://twitter.com/paolapr23/status/1111047742913241090
;2019-03-27 23:24;1;4;"Great to have my @ Medtronic colleague @ jtrauring joining # Comm385 tonight to discuss media relations with our @ MetroPRMajors students. # mediarelations # crisiscommspic.twitter.com/xfYVUekuvR";;@ @ @;# # #;"1111046488577191942";https://twitter.com/gz_/status/1111046488577191942
;2019-03-27 23:19;0;0;"Homeland Security warns of critical flaws in Medtronic defibrillators http://dlvr.it/R1h1hb pic.twitter.com/i0NeyZhhG8";;;;"1111044990786920448";https://twitter.com/mappenapp/status/1111044990786920448
;2019-03-27 23:08;0;0;"Medtronic launches innovation accelerator & more: 8 device company notes http://dlvr.it/R1h0RM";;;;"1111042351399493633";https://twitter.com/BeckersSpine/status/1111042351399493633
;2019-03-27 23:08;1;3;"It is too late for me. I already have dbs by Medtronic’s and all of the damage. The FDA should compensate me for approving it as safe.";;;;"1111042282730504192";https://twitter.com/Terri27903773/status/1111042282730504192
;2019-03-27 23:00;0;0;"Medtronic cardiac implants can be hacked, FDA issues alert https://buff.ly/2FsKcAy";;;;"1111040252821544961";https://twitter.com/JasonWiele/status/1111040252821544961
;2019-03-27 22:36;0;0;"Great Job @ Medtronic ,yet another recall???? This is what your doctors will push on you and insurance companies. Little or No # FDA oversighthttps://twitter.com/arstechnica/status/1111030206666547200 …";;@;#;"1111034250717990912";https://twitter.com/chickchick42/status/1111034250717990912
;2019-03-27 22:21;0;1;"But this is just silly. The civilized world manages to provide superior health care at 1/3 less cost without AI (which may have dangers outweighing the benefits). Why not take a wee little peek at what they do?";;;;"1111030562460979201";https://twitter.com/pleyel1848/status/1111030562460979201
;2019-03-27 22:12;1;29;"Off to 10,000 lakes regional sponsored by the Medtronic foundation # OMGRobots # FRC10KLakespic.twitter.com/udSKUDDuLb";;;# #;"1111028296169504768";https://twitter.com/CIS4607/status/1111028296169504768
;2019-03-27 22:12;0;0;"750,000 Medtronic defibrillators vulnerable to hacking https://buff.ly/2Wbhr1W";;;;"1111028119958441985";https://twitter.com/klosnet/status/1111028119958441985
;2019-03-27 22:05;0;1;"We'd love to meet you and hear how you imagine your future. Don't forget to stop by and join us tomorrow night from 8:30-10:30pm at the # NSBE45 Medtronic hospitality suite 354. # ExploreEngineerElevate # CareersThatChangeLivespic.twitter.com/q5egV9iBB9";;;# # #;"1111026377908776960";https://twitter.com/MedtronicJobs/status/1111026377908776960
;2019-03-27 22:05;0;1;"Medtronic Flaws Could Let Hackers Control Devices http://dlvr.it/R1grf8 pic.twitter.com/YGkRZWCNIH";;;;"1111026368442044416";https://twitter.com/OculusVT/status/1111026368442044416
;2019-03-27 21:58;0;0;"All based on volume to insurance company models. Need to go away from insurance based medicine & work with Direct Primary Care groups & surgery centers like Oklahoma surgery center if they really r interested in Healthcare or just profits. http://www.unclesamhealthcare.com 4 info";;;;"1111024833058336768";https://twitter.com/fritz_sproul/status/1111024833058336768
