username;date;retweets;favorites;text;geo;mentions;hashtags;id;permalink
;2019-03-11 20:34;0;0;"Lansdowne Partners Uk Llp Lowered Its Amazon Com $ AMZN Stake; 8 Analysts Are Bullish Abbott Laboratories $ ABT Last Week https://finreviewer.com/2019/03/11/lansdowne-partners-uk-llp-lowered-its-amazon-com-amzn-stake-8-analysts-are-bullish-abbott-laboratories-abt-last-week/ …";;;;"1105205386246795264";https://twitter.com/thefinreviewer/status/1105205386246795264
;2019-03-11 20:10;0;0;"This is what analysts have to say about Abbott Laboratories $ ABT after last week. https://www.mmahotstuff.com/2019/03/11/this-is-what-analysts-have-to-say-about-abbott-laboratories-nyseabt-after-last-week.html …";;;;"1105199235488776195";https://twitter.com/mmahotstuff1/status/1105199235488776195
;2019-03-11 20:10;0;0;"Abbott Laboratories (ABT) Shares Bought by Winslow Evans & Crocker Inc. https://stocknewstimes.com/2018/03/14/abbott-laboratories-abt-stake-raised-by-winslow-evans-crocker-inc.html … $ ABT # stocks # stockmarket";;;# #;"1105199231638360069";https://twitter.com/StocksPredictr/status/1105199231638360069
;2019-03-11 19:05;0;0;"Apple $ AAPL Shareholder Wellcome Trust LTD Has Cut Holding; Family Capital Trust Co Has Cut Its Abbott Laboratories $ ABT Holding by $303,192; Shares Rose https://finexaminer.com/2019/03/11/apple-aapl-shareholder-wellcome-trust-ltd-has-cut-holding-family-capital-trust-co-has-cut-its-abbott-laboratories-abt-holding-by-303192-shares-rose/ …";;;;"1105182970397290501";https://twitter.com/thefinreviewer/status/1105182970397290501
;2019-03-11 19:01;0;0;"Abbott Laboratories $ ABT Holder Old West Investment Management Decreased Position as Shares Rose; American Financial Group Has Boosted Position in Nexstar Media Group $ NXST by $4.06 Million https://finexaminer.com/2019/03/11/abbott-laboratories-abt-holder-old-west-investment-management-decreased-position-as-shares-rose-american-financial-group-has-boosted-position-in-nexstar-media-group-nxst-by-4-06-million/ …";;;;"1105181869853822976";https://twitter.com/thefinreviewer/status/1105181869853822976
;2019-03-11 18:38;0;0;"Hugh Johnson Advisors Position In Abbott Laboratories $ ABT Was Raised; Fox Factory Holding $ FOXF Share Value Declined While Meritage Portfolio Management Has Trimmed Positionhttps://finheadlines.com/2019/03/11/hugh-johnson-advisors-position-in-abbott-laboratories-abt-was-raised-fox-factory-holding-foxf-share-value-declined-while-meritage-portfolio-management-has-trimmed-position/ …";;;;"1105176157346033664";https://twitter.com/HeadlinesFin/status/1105176157346033664
;2019-03-11 18:34;0;0;"Abbott Labs $ ABT Holder Sectoral Asset Management Lowered Position as Stock Rose; Equity Lifestyle Pptys $ ELS Stake Held by Resolution Capital Ltdhttps://finheadlines.com/2019/03/11/abbott-labs-abt-holder-sectoral-asset-management-lowered-position-as-stock-rose-equity-lifestyle-pptys-els-stake-held-by-resolution-capital-ltd/ …";;;;"1105175263883739138";https://twitter.com/HeadlinesFin/status/1105175263883739138
;2019-03-11 17:25;0;0;"Hugh Johnson Advisors Has Raised By $3.14 Million Its Abbott Laboratories $ ABT Stake; Blackrock Municipal Target Term Trust $ BTT's Sentiment Is 1.28https://finreviewer.com/2019/03/11/hugh-johnson-advisors-has-raised-by-3-14-million-its-abbott-laboratories-abt-stake-blackrock-municipal-target-term-trust-btts-sentiment-is-1-28/ …";;;;"1105157817667911681";https://twitter.com/thefinreviewer/status/1105157817667911681
;2019-03-11 17:14;0;0;"H&R Block $ HRB Stock "Hold" Rating Reiterated at BMO Capital; The PT Given is $25; Hbk Sorce Advisory Has Upped By $337,320 Its Abbott Labs $ ABT Stake https://yomiblog.com/2019/03/11/h-the-pt-given-is-25-hbk-sorce-advisory-has-upped-by-337320-its-abbott-labs-abt-stake/ …";;;;"1105155072319725569";https://twitter.com/BlogYomi/status/1105155072319725569
;2019-03-11 17:06;0;0;"New subboard for # Bigpharma interest in # genetherapy. Surprised to see that $ AMGN has 72 clinical trials recruiting or not yet recruiting for # Celltherapy. Very involved in CAR-T # oncology $ ABT seems least likely to be involved in any M&A. http://bridgeandtunnelinvestor.com/board/467/big-pharma …";;;# # # #;"1105153065487745024";https://twitter.com/mchilberg/status/1105153065487745024
;2019-03-11 17:02;0;0;"Bowen Hanes & Co Holds Holding in Abbott Laboratories $ ABT; As Cf Industries Holdings In $ CF Share Price Declined, Holder Hartford Investment Management Co Decreased Its Stakehttps://yomiblog.com/2019/03/11/bowen-hanes-as-cf-industries-holdings-in-cf-share-price-declined-holder-hartford-investment-management-co-decreased-its-stake/ …";;;;"1105152072943583232";https://twitter.com/BlogYomi/status/1105152072943583232
;2019-03-11 16:09;0;0;"Ls Investment Advisors Lowered Position in Pfizer $ PFE as Market Value Declined; As Abbott Laboratories $ ABT Stock Value Rose, Holder First Financial Bank - Trust Division Cut Its Position https://finreviewer.com/2019/03/11/ls-investment-advisors-lowered-position-in-pfizer-pfe-as-market-value-declined-as-abbott-laboratories-abt-stock-value-rose-holder-first-financial-bank-trust-division-cut-its-position/ …";;;;"1105138571835572224";https://twitter.com/thefinreviewer/status/1105138571835572224
;2019-03-11 14:36;0;0;"Short sale vol (not short interest) for $ AGN on 2019-03-08 is 68%. http://shortvolumes.com/?t=AGN $ MYL 61% $ ABT 53% $ XLV 69% $ ZTS 57%";;;;"1105115165832474629";https://twitter.com/shortvolumes/status/1105115165832474629
;2019-03-11 13:54;0;0;"As Abbott Laborator $ ABT Market Valuation Rose, Shareholder Swedbank Lifted Position; United Rentals $ URI Shareholder Two Sigma Securities Has Lifted Its Stake by $418,914 as Shares Rosehttps://hinewulm.com/2019/03/11/as-abbott-laborator-abt-market-valuation-rose-shareholder-swedbank-lifted-position-united-rentals-uri-shareholder-two-sigma-securities-has-lifted-its-stake-by-418914-as-shares-rose/ …";;;;"1105104632446111744";https://twitter.com/UlmHi/status/1105104632446111744
;2019-03-11 13:52;0;0;"Dekabank Deutsche Girozentrale Has Increased Abbott Labs $ ABT Holding; Integrated Device Technology $ IDTI Share Price Rose While Alpine Associates Management Lifted Its Holding https://hinewulm.com/2019/03/11/dekabank-deutsche-girozentrale-has-increased-abbott-labs-abt-holding-integrated-device-technology-idti-share-price-rose-while-alpine-associates-management-lifted-its-holding/ …";;;;"1105104215838474240";https://twitter.com/UlmHi/status/1105104215838474240
;2019-03-11 13:50;0;0;"Barclays Analysts Give Abbott Laboratories $ ABT a $84.00 Price Target http://zpr.io/gm6kz";;;;"1105103751633883137";https://twitter.com/TranscriptDaily/status/1105103751633883137
;2019-03-11 13:38;0;0;"Somerville Kurt F Raised Chevron $ CVX Stake by $364,932 as Valuation Rose; As Abbott Laboratories $ ABT Stock Rose, Family Capital Trust Co Has Trimmed Position by $303,192 https://finheadlines.com/2019/03/11/somerville-kurt-f-raised-chevron-cvx-stake-by-364932-as-valuation-rose-as-abbott-laboratories-abt-stock-rose-family-capital-trust-co-has-trimmed-position-by-303192/ …";;;;"1105100769949302784";https://twitter.com/HeadlinesFin/status/1105100769949302784
;2019-03-11 13:34;0;0;"Abbott Laboratories $ ABT Given a $84.00 Price Target at Barclays http://americanbankingnews.com/?p=9765282 # stocks";;;#;"1105099706663874560";https://twitter.com/AmericanBanking/status/1105099706663874560
;2019-03-11 13:33;0;0;"Barclays Analysts Give Abbott Laboratories $ ABT a $84.00 Price Target http://baseballnewssource.com/?p=3272690";;;;"1105099492058124288";https://twitter.com/bbnsnews/status/1105099492058124288
;2019-03-11 13:23;0;0;"$ ABT Max Pain=75.00. Maturity=03/15/2019. # maxpain # options http://maximum-pain.com/options/max-pain/ABT …pic.twitter.com/jKFDouNr9Q";;;# #;"1105097000356331520";https://twitter.com/optioncharts/status/1105097000356331520
;2019-03-11 13:20;0;0;"Family Capital Trust Co Trimmed Its Abbott Laboratories $ ABT Stake by $303,192; Stock Value Rose; Ambev Sa $ Adr $ ABEV Holder Cullen Capital Management Upped Holdinghttps://hinewulm.com/2019/03/11/family-capital-trust-co-trimmed-its-abbott-laboratories-abt-stake-by-303192-stock-value-rose-ambev-sa-adr-abev-holder-cullen-capital-management-upped-holding/ …";;;;"1105096217703403520";https://twitter.com/UlmHi/status/1105096217703403520
;2019-03-11 13:17;0;0;"Scholtz & Company Has Boosted Its Abbott Laboratories $ ABT Holding; First Citizens Bancshares $ FCNCA's Sentiment Is 1.01https://hinewulm.com/2019/03/11/scholtz-first-citizens-bancshares-fcncas-sentiment-is-1-01/ …";;;;"1105095436652736512";https://twitter.com/UlmHi/status/1105095436652736512
;2019-03-11 13:16;0;0;"Portolan Capital Management Has Trimmed Its Stake in Aaron Rents $ AAN as Stock Price Rose; As Abbott Labs $ ABT Shares Rose, Teachers Retirement System Of The State Of Kentucky Boosted Stake https://finheadlines.com/2019/03/11/portolan-capital-management-has-trimmed-its-stake-in-aaron-rents-aan-as-stock-price-rose-as-abbott-labs-abt-shares-rose-teachers-retirement-system-of-the-state-of-kentucky-boosted-stake/ …";;;;"1105095128199426048";https://twitter.com/HeadlinesFin/status/1105095128199426048
;2019-03-11 13:12;0;0;"Aramark $ ARMK Holder Corsair Capital Management LP Cut Its Position by $2.24 Million; Canada Pension Plan Investment Board Trimmed Abbott Labs Com $ ABT Holding by $97.37 Million as Market Value Rose https://finexaminer.com/2019/03/11/aramark-armk-holder-corsair-capital-management-lp-cut-its-position-by-2-24-million-canada-pension-plan-investment-board-trimmed-abbott-labs-com-abt-holding-by-97-37-million-as-market-value-rose/ …";;;;"1105094108060762113";https://twitter.com/thefinreviewer/status/1105094108060762113
;2019-03-11 13:11;0;0;"Emerald Mutual Fund Advisers Trust Stake in Opus Bank $ OPB Has Trimmed as Shares Rose; Hbk Sorce Advisory Holding in Abbott Labs $ ABT Has Increased by $337,320 https://finexaminer.com/2019/03/11/emerald-mutual-fund-advisers-trust-stake-in-opus-bank-opb-has-trimmed-as-shares-rose-hbk-sorce-advisory-holding-in-abbott-labs-abt-has-increased-by-337320/ …";;;;"1105093827147251717";https://twitter.com/thefinreviewer/status/1105093827147251717
;2019-03-11 13:06;0;0;"Blb&B Advisors Holding in Goodyear Tire & Rubr Co $ GT Trimmed by $335,300 as Share Value Declined; Umb Bank N A Raised Abbott Laboratories $ ABT Position by $724,968 https://yomiblog.com/2019/03/11/blb-umb-bank-n-a-raised-abbott-laboratories-abt-position-by-724968/ …";;;;"1105092570395406336";https://twitter.com/BlogYomi/status/1105092570395406336
;2019-03-11 13:02;0;0;"Cibc World Markets Stake in Crown Castle Intl New Com $ CCI Increased as Shares Rose; Abbott Labs $ ABT Holder Duquesne Family Office Has Increased Holding https://finexaminer.com/2019/03/11/cibc-world-markets-stake-in-crown-castle-intl-new-com-cci-increased-as-shares-rose-abbott-labs-abt-holder-duquesne-family-office-has-increased-holding/ …";;;;"1105091743295463430";https://twitter.com/thefinreviewer/status/1105091743295463430
;2019-03-11 12:48;0;0;"Hugh Johnson Advisors LLC Has Raised Abbott Laboratories $ ABT Position by $3.14 Million https://www.mmahotstuff.com/2019/03/11/hugh-johnson-advisors-llc-has-raised-abbott-laboratories-abt-position-by-3-14-million.html …";;;;"1105088137435459591";https://twitter.com/mmahotstuff1/status/1105088137435459591
;2019-03-11 12:48;0;0;"Hugh Johnson Advisors LLC Increased Its Stake in Abbott Laboratories $ ABT by $3.14 Million https://whatsonthorold.com/2019/03/11/hugh-johnson-advisors-llc-increased-its-stake-in-abbott-laboratories-abt-by-3-14-million/ …";;;;"1105088078908194817";https://twitter.com/whatsonthorold2/status/1105088078908194817
;2019-03-11 12:27;0;0;"Abbott Laboratories $ ABT Insider Sells $428,065.00 in Stock http://www.thestockobserver.com/?p=1998025";;;;"1105082907490766848";https://twitter.com/stocknewstimes/status/1105082907490766848
;2019-03-11 12:20;0;0;"Abbott Laboratories $ ABT Insider Sells $428,065.00 in Stock http://zpr.io/gmn4u";;;;"1105080972083630081";https://twitter.com/TheMarketsDaily/status/1105080972083630081
;2019-03-11 12:18;0;0;"As Abbott Laboratories $ ABT Shares Rose, Shareholder Hugh Johnson Advisors LLC Increased Stake by $3.14 Million https://enbulletin.com/2019/03/11/as-abbott-laboratories-abt-shares-rose-shareholder-hugh-johnson-advisors-llc-increased-stake-by-3-14-million/ …";;;;"1105080449590796288";https://twitter.com/bulletin_en/status/1105080449590796288
;2019-03-11 12:04;0;1;"$ drgn - معجب فيها $ SUMO $ BEZ - هذه بصراحة متورط فيها و اطمع في تحليلها $ dadi $ SS $ OCN $ daps $ CV $ ABT - حذفوها قبل فترة بسيطة من منصة لا اتذكرها";;;;"1105077042993905664";https://twitter.com/a_aljayyash/status/1105077042993905664
;2019-03-11 11:29;0;0;"Abbott Laboratories $ ABT to pay $0.32 on May 15, 2019; G1 Therapeutics $ GTHX Shorts Up By 1.7%https://hinewulm.com/2019/03/11/abbott-laboratories-abt-to-pay-0-32-on-may-15-2019-g1-therapeutics-gthx-shorts-up-by-1-7/ …";;;;"1105068174020628484";https://twitter.com/UlmHi/status/1105068174020628484
;2019-03-11 10:58;0;0;"South State Has Cut Stake in Abbott Labs $ ABT by $310,464 as Stock Value Rose; As American Intl Group $ AIG Stock Value Declined, Holder Eagleclaw Capital Managment Has Cut Its Holding https://yomiblog.com/2019/03/11/south-state-has-cut-stake-in-abbott-labs-abt-by-310464-as-stock-value-rose-as-american-intl-group-aig-stock-value-declined-holder-eagleclaw-capital-managment-has-cut-its-holding/ …";;;;"1105060383000276992";https://twitter.com/BlogYomi/status/1105060383000276992
;2019-03-11 10:50;0;0;"Founders Capital Management Trimmed Abbott Laboratories $ ABT Position; Alexandria Capital Has Cut Spirit Airls $ SAVE Stakehttps://finheadlines.com/2019/03/11/founders-capital-management-trimmed-abbott-laboratories-abt-position-alexandria-capital-has-cut-spirit-airls-save-stake/ …";;;;"1105058516748943361";https://twitter.com/HeadlinesFin/status/1105058516748943361
;2019-03-11 10:48;0;0;"Discovery Capital Management Stake In Marathon Pete $ MPC Was Raised; Abbott Laboratories $ ABT Stock Rose While Boyd Watterson Asset Management Cut by $324,000 Its Position https://yomiblog.com/2019/03/11/discovery-capital-management-stake-in-marathon-pete-mpc-was-raised-abbott-laboratories-abt-stock-rose-while-boyd-watterson-asset-management-cut-by-324000-its-position/ …";;;;"1105057781797830661";https://twitter.com/BlogYomi/status/1105057781797830661
;2019-03-11 10:38;0;0;"Owens & Minor New $ OMI Stock Declined While Brandes Investment Partners LP Has Decreased by $2.15 Million Its Position; Abbott Labs $ ABT Position Upped by Middleton & Co Inc https://hinewulm.com/2019/03/11/owens-abbott-labs-abt-position-upped-by-middleton-co-inc/ …";;;;"1105055396178333696";https://twitter.com/UlmHi/status/1105055396178333696
;2019-03-11 10:22;0;0;"Keystone Financial Planning Cut Anheuser $ BUD Stake by $584,025 as Valuation Rose; As Abbott Labs $ ABT Market Value Rose, First Financial Has Cut Its Stake https://finreviewer.com/2019/03/11/keystone-financial-planning-cut-anheuser-bud-stake-by-584025-as-valuation-rose-as-abbott-labs-abt-market-value-rose-first-financial-has-cut-its-stake/ …";;;;"1105051311391850497";https://twitter.com/thefinreviewer/status/1105051311391850497
;2019-03-11 10:02;0;0;"Devon Energy New $ DVN Stock Rose While Murphy Pohlad Asset Management Has Lifted Its Stake; Cookson Peirce & Co Decreased Abbott Labs $ ABT Holding as Valuation Rose https://finexaminer.com/2019/03/11/devon-energy-new-dvn-stock-rose-while-murphy-pohlad-asset-management-has-lifted-its-stake-cookson-peirce-co-decreased-abbott-labs-abt-holding-as-valuation-rose/ …";;;;"1105046434959761408";https://twitter.com/thefinreviewer/status/1105046434959761408
;2019-03-11 10:01;0;0;"Omers Administration Trimmed Holding in Ross Stores $ ROST by $6.51 Million; Abbott Labs Com $ ABT Shareholder Moneta Group Investment Advisors Has Increased Position by $503,352 as Market Valuation Rose https://finreviewer.com/2019/03/11/omers-administration-trimmed-holding-in-ross-stores-rost-by-6-51-million-abbott-labs-com-abt-shareholder-moneta-group-investment-advisors-has-increased-position-by-503352-as-market-valuation-r/ …";;;;"1105046199223156737";https://twitter.com/thefinreviewer/status/1105046199223156737
;2019-03-11 07:02;0;0;"Abbott Laboratories $ ABT PT Set at $84.00 by Barclays http://zpr.io/gmUGW";;;;"1105001028452302848";https://twitter.com/ConsumerFeed/status/1105001028452302848