username;date;retweets;favorites;text;geo;mentions;hashtags;id;permalink
;2019-03-10 22:11;0;0;"Open position: $ PG (long) Entry: $98.78 Stop: $97.69 Comment: broke out right after my entry, but then it got dragged down when the whole market experienced a sell-off. The support area is still nicely in play and this stock shows relative strength compared to the $ SPX.pic.twitter.com/uXAqHcVAo4";;;;"1104867467627765765";https://twitter.com/TradeMarkWM/status/1104867467627765765
;2019-03-10 21:21;0;0;"As Encana $ ECA Share Price Rose, Jvl Advisors Has Boosted Position; As Procter & Gamble Co $ PG Market Valuation Rose, Holder Hl Financial Services Lowered Its Stake https://yomiblog.com/2019/03/10/as-encana-eca-share-price-rose-jvl-advisors-has-boosted-position-as-procter-gamble-co-pg-market-valuation-rose-holder-hl-financial-services-lowered-its-stake/ …";;;;"1104854762359541761";https://twitter.com/BlogYomi/status/1104854762359541761
;2019-03-10 21:06;0;0;"Procter & Gamble Company $ PG Sellers Strengthened By 14.81% Their Shorts https://enbulletin.com/2019/03/10/procter-gamble-company-the-nysepg-sellers-strengthened-by-14-81-their-shorts/ …";;;;"1104850929512271873";https://twitter.com/bulletin_en/status/1104850929512271873
;2019-03-10 21:02;0;0;"Torch Wealth Management Has Increased Its Position in Microsoft $ MSFT by $412,686 as Shares Rose; Procter & Gamble Co $ PG Shareholder Stewart & Patten Co Lowered Holding by $353,171 as Market Value Rose https://finheadlines.com/2019/03/10/torch-wealth-management-has-increased-its-position-in-microsoft-msft-by-412686-as-shares-rose-procter-gamble-co-pg-shareholder-stewart-patten-co-lowered-holding-by-353171-as-market-value/ …";;;;"1104850014814248960";https://twitter.com/HeadlinesFin/status/1104850014814248960
;2019-03-10 21:00;0;0;"Procter & Gamble Company $PG’s Trend Unknown, Especially After Increased Shorts https://whatsonthorold.com/2019/03/10/procter-gamble-company-the-nysepgs-trend-unknown-especially-after-increased-shorts/ …";;;;"1104849424289796096";https://twitter.com/whatsonthorold2/status/1104849424289796096
;2019-03-10 20:59;0;0;"Procter & Gamble Co $ PG Stock Price Rose While Srb Trimmed Its Stake by $591,045; As Nike $ NKE Market Valuation Rose, Wafra Investment Advisory Group Boosted Position by $3.82 Million https://hinewulm.com/2019/03/10/procter-as-nike-nke-market-valuation-rose-wafra-investment-advisory-group-boosted-position-by-3-82-million/ …";;;;"1104849352332324865";https://twitter.com/UlmHi/status/1104849352332324865
;2019-03-10 20:37;0;0;"As Procter And Gamble Co $ PG Market Value Rose, Shareholder Miracle Mile Advisors Has Cut Holding; Iac Interactivecorp $ IACI Share Price Were Volatile While Telemark Asset Management Has Trimmed Its Stake https://yomiblog.com/2019/03/10/as-procter-and-gamble-co-pg-market-value-rose-shareholder-miracle-mile-advisors-has-cut-holding-iac-interactivecorp-iaci-share-price-were-volatile-while-telemark-asset-management-has-trimmed-its/ …";;;;"1104843814261440513";https://twitter.com/BlogYomi/status/1104843814261440513
;2019-03-10 20:36;0;0;"Holder Perceptive Advisors Has Lifted Quotient LTD $ QTNT Holding; As Procter And Gamble Co $ PG Market Valuation Rose, Hanson Mcclain Has Lowered Stake https://hinewulm.com/2019/03/10/holder-perceptive-advisors-has-lifted-quotient-ltd-qtnt-holding-as-procter-and-gamble-co-pg-market-valuation-rose-hanson-mcclain-has-lowered-stake/ …";;;;"1104843445317840900";https://twitter.com/UlmHi/status/1104843445317840900
;2019-03-10 20:36;0;0;"Van Strum & Towne Decreased Its Procter& Gamble Company $ PG Holding as Share Value Rose; Chevron New $ CVX Stock Value Rose While Hanson Mcclain Has Raised Its Positionhttps://finheadlines.com/2019/03/10/van-strum-chevron-new-cvx-stock-value-rose-while-hanson-mcclain-has-raised-its-position/ …";;;;"1104843432491667456";https://twitter.com/HeadlinesFin/status/1104843432491667456
;2019-03-10 20:35;0;0;"As Tesla $ Put $ TSLA Shares Declined, Mkp Capital Management Has Lowered Its Stake; As Procter And Gamble Co $ PG Shares Rose, Holder Hanson Mcclain Has Lowered by $392,392 Its Stake https://finheadlines.com/2019/03/10/as-tesla-put-tsla-shares-declined-mkp-capital-management-has-lowered-its-stake-as-procter-and-gamble-co-pg-shares-rose-holder-hanson-mcclain-has-lowered-by-392392-its-stake/ …";;;;"1104843152467415042";https://twitter.com/HeadlinesFin/status/1104843152467415042
;2019-03-10 20:30;0;0;"As Procter&Gamble $ PG Stock Rose, Mondrian Investment Partners LTD Trimmed Position; Rampart Investment Management Company Continues to Hold Stake in Alliant Energy $ LNT https://finexaminer.com/2019/03/10/as-procter-rampart-investment-management-company-continues-to-hold-stake-in-alliant-energy-lnt/ …";;;;"1104842027244621826";https://twitter.com/thefinreviewer/status/1104842027244621826
;2019-03-10 20:30;0;0;"Long Road Investment Counsel Stake in Thermo Fisher Scientific $ TMO Has Lowered by $429,275; Procter And Gamble Co $ PG Holder Mastrapasqua Asset Management Boosted Position https://hinewulm.com/2019/03/10/long-road-investment-counsel-stake-in-thermo-fisher-scientific-tmo-has-lowered-by-429275-procter-and-gamble-co-pg-holder-mastrapasqua-asset-management-boosted-position/ …";;;;"1104841948131704832";https://twitter.com/UlmHi/status/1104841948131704832
;2019-03-10 20:22;0;0;"Skba Capital Management Decreased Its Procter And Gamble Co (PG) Holding ... https://wolcottdaily.com/skba-capital-management-decreased-its-procter-and-gamble-co-pg-holding-atlas-air-worldwide-holdings-inc-aaww-covered-by-3-bulls/ … $ PG # stocks # stockmarket";;;# #;"1104840044198744065";https://twitter.com/StockScoops/status/1104840044198744065
;2019-03-10 20:02;0;0;"Microsoft $ MSFT Shareholder Syntal Capital Partners Lowered Its Holding by $2.52 Million; As Procter & Gamble Co $ PG Stock Value Rose, Raymond James Trust Increased by $303,121 Its Stake https://yomiblog.com/2019/03/10/microsoft-msft-shareholder-syntal-capital-partners-lowered-its-holding-by-2-52-million-as-procter-gamble-co-pg-stock-value-rose-raymond-james-trust-increased-by-303121-its-stake/ …";;;;"1104834912903942144";https://twitter.com/BlogYomi/status/1104834912903942144
;2019-03-10 19:58;0;0;"Lincoln Capital Decreased Procter And Gamble Co $ PG Position by $370,916 as Stock Value Rose; Contravisory Investment Management Has Upped Its Holding in Sysco $ SYY by $3.51 Millionhttps://finheadlines.com/2019/03/10/lincoln-capital-decreased-procter-and-gamble-co-pg-position-by-370916-as-stock-value-rose-contravisory-investment-management-has-upped-its-holding-in-sysco-syy-by-3-51-million/ …";;;;"1104833867465322496";https://twitter.com/HeadlinesFin/status/1104833867465322496
;2019-03-10 19:52;0;0;"As Procter & Gamble Co $ PG Stock Price Rose, Holder Srb Decreased Stake; St Germain D J Co Stake in General Electric $ GE Has Cut by $2.17 Millionhttps://finheadlines.com/2019/03/10/as-procter-st-germain-d-j-co-stake-in-general-electric-ge-has-cut-by-2-17-million/ …";;;;"1104832510033383427";https://twitter.com/HeadlinesFin/status/1104832510033383427
;2019-03-10 19:48;0;0;"Shaker Investments Has Lifted Its Holding in Paylocity Hldg $ PCTY by $303,180; Holder Nine Masts Capital LTD Increased Procter And Gamble Co $ PG Holding https://yomiblog.com/2019/03/10/shaker-investments-has-lifted-its-holding-in-paylocity-hldg-pcty-by-303180-holder-nine-masts-capital-ltd-increased-procter-and-gamble-co-pg-holding/ …";;;;"1104831485536845825";https://twitter.com/BlogYomi/status/1104831485536845825
;2019-03-10 19:23;0;0;"Procter & Gamble Co. $ PG Holder Kelly Lawrence W & Associates Lowered Its Stake; Grupo Televisa Sa $ TV Stock Declined While Marathon Asset Management Llp Has Decreased Its Stake https://yomiblog.com/2019/03/10/procter-grupo-televisa-sa-tv-stock-declined-while-marathon-asset-management-llp-has-decreased-its-stake/ …";;;;"1104825113567002631";https://twitter.com/BlogYomi/status/1104825113567002631
;2019-03-10 19:17;0;0;"Willow Creek Wealth Management Increased Its Procter And Gamble Co $ PG Holding; Mackay Shields Lifted Its Teva Pharmaceutical Inds LTD $ TEVA Positionhttps://yomiblog.com/2019/03/10/willow-creek-wealth-management-increased-its-procter-and-gamble-co-pg-holding-mackay-shields-lifted-its-teva-pharmaceutical-inds-ltd-teva-position/ …";;;;"1104823638082097152";https://twitter.com/BlogYomi/status/1104823638082097152
;2019-03-10 19:10;0;0;"As Procter & Gamble $ PG Market Value Rose, Schulhoff & Co Has Boosted Stake; Brady $ BRC Holder Algert Global Raised Its Stake https://yomiblog.com/2019/03/10/as-procter-brady-brc-holder-algert-global-raised-its-stake/ …";;;;"1104821808816181249";https://twitter.com/BlogYomi/status/1104821808816181249
;2019-03-10 19:00;0;0;"Msft $ MSFT Valuation Rose While Fulton Breakefield Broenniman Has Lowered Stake by $1.52 Million; Procter And Gamble Co $ PG Position Has Boosted by Sterling Global Strategies Llc https://finreviewer.com/2019/03/10/msft-msft-valuation-rose-while-fulton-breakefield-broenniman-has-lowered-stake-by-1-52-million-procter-and-gamble-co-pg-position-has-boosted-by-sterling-global-strategies-llc/ …";;;;"1104819366288412672";https://twitter.com/thefinreviewer/status/1104819366288412672
;2019-03-10 18:46;0;0;"Founders Financial Securities Has Decreased Stake in Procter And Gamble Co $ PG by $594,594 as Stock Rose; As Core Laboratories N V $ CLB Shares Declined, Marble Harbor Investment Counsel Has Increased Positionhttps://finreviewer.com/2019/03/10/founders-financial-securities-has-decreased-stake-in-procter-and-gamble-co-pg-by-594594-as-stock-rose-as-core-laboratories-n-v-clb-shares-declined-marble-harbor-investment-counsel-has-increase/ …";;;;"1104815810999132161";https://twitter.com/thefinreviewer/status/1104815810999132161
;2019-03-10 18:40;0;0;"As Procter & Gamble $ PG Shares Rose, Shareholder Barr E S & Co Cut Its Position; As Dcp Midstream LP $ DPM Market Value Were Volatile, Salient Capital Advisors Boosted Its Stake by $1.44 Millionhttps://finreviewer.com/2019/03/10/as-procter-as-dcp-midstream-lp-dpm-market-value-were-volatile-salient-capital-advisors-boosted-its-stake-by-1-44-million/ …";;;;"1104814370545119233";https://twitter.com/thefinreviewer/status/1104814370545119233
;2019-03-10 18:36;0;0;"As Union Pac $ UNP Market Value Rose, Jones Financial Companies Lllp Cut Holding by $496,662; Procter & Gamble Co $ PG Shares Rose While Hills Bank & Trust Company Has Cut Position https://finexaminer.com/2019/03/10/as-union-pac-unp-market-value-rose-jones-financial-companies-lllp-cut-holding-by-496662-procter-gamble-co-pg-shares-rose-while-hills-bank-trust-company-has-cut-position/ …";;;;"1104813280126816256";https://twitter.com/thefinreviewer/status/1104813280126816256
;2019-03-10 18:34;0;0;"Williams Jones & Associates Lifted Its Holding in Medtronic Plc Shs $ MDT by $393,930; Compton Capital Management Cut Its Stake in Procter & Gamble Co $ PG by $338,429 https://finheadlines.com/2019/03/10/williams-jones-compton-capital-management-cut-its-stake-in-procter-gamble-co-pg-by-338429/ …";;;;"1104812802152247306";https://twitter.com/HeadlinesFin/status/1104812802152247306
;2019-03-10 18:23;0;0;"Northern Capital Management Has Trimmed Its Stake in Procter & Gamble Co $ PG by $862,680 as Stock Price Rose; As Transocean LTD $ RIG Valuation Declined, Van Den Berg Management I Has Raised Position by $6.20 Millionhttps://finreviewer.com/2019/03/10/northern-capital-management-has-trimmed-its-stake-in-procter-as-transocean-ltd-rig-valuation-declined-van-den-berg-management-i-has-raised-position/ …";;;;"1104810011253981184";https://twitter.com/thefinreviewer/status/1104810011253981184
;2019-03-10 18:22;0;0;"Peoples Financial Services Trimmed Its Position in Procter & Gamble Co Com $ PG by $1.60 Million as Stock Price Rose; Ford Mtr Co Del $ F Holder Hengehold Capital Management Has Lowered Its Stake by $390,313 as Market Valuation Declinedhttps://finreviewer.com/2019/03/10/peoples-financial-services-trimmed-its-position-in-procter-ford-mtr-co-del-f-holder-hengehold-capital-management-has-lowered-its-st/ …";;;;"1104809805385007104";https://twitter.com/thefinreviewer/status/1104809805385007104
;2019-03-10 18:18;0;0;"Blb&B Advisors Cut Its Procter And Gamble Co $ PG Position as Share Value Rose; As Intel $ INTC Market Value Rose, Lafayette Investments Has Boosted Positionhttps://finheadlines.com/2019/03/10/blb-as-intel-intc-market-value-rose-lafayette-investments-has-boosted-position/ …";;;;"1104808739608150030";https://twitter.com/HeadlinesFin/status/1104808739608150030
;2019-03-10 18:18;0;1;"are the analyst wrong with $ amzn ??? $ BA $ XLI $ INTC $ STM $ TXN $ NFLX $ JPM $ GS $ smh $ spy $ spx $ AAPL $ BAC $ PG $ YHOO $ CHK $ WFC $ FB $ CRM $ GE $ MU $ NFLXpic.twitter.com/SWWI9fbIAV";;;;"1104808737334800385";https://twitter.com/StockToDiscover/status/1104808737334800385
;2019-03-10 17:54;1;1;"YTD losers (over a $1B market cap) $ BA $ XLI $ INTC $ STM $ TXN $ NFLX $ JPM $ GS $ smh $ spy $ spx $ AAPL $ BAC $ PG $ YHOO $ CHK $ WFC $ FB $ CRM $ GE $ MU $ NFLXpic.twitter.com/4wYdkTGoIa";;;;"1104802746786553861";https://twitter.com/StockToDiscover/status/1104802746786553861
;2019-03-10 17:53;0;1;"YTD winners $ BA $ XLI $ INTC $ STM $ TXN $ NFLX $ JPM $ GS $ smh $ spy $ spx $ AAPL $ BAC $ PG $ YHOO $ CHK $ WFC $ FB $ CRM $ GE $ MU $ NFLXpic.twitter.com/FId4KisVeM";;;;"1104802379831173120";https://twitter.com/StockToDiscover/status/1104802379831173120
;2019-03-10 17:46;0;0;"As Procter & Gamble Co $ PG Shares Rose, Gemmer Asset Management Cut Stake by $982,345; Winslow Evans & Crocker Has Trimmed Position in Yum Brands $ YUM by $865,904https://finheadlines.com/2019/03/10/as-procter-winslow-evans-crocker-has-trimmed-position-in-yum-brands-yum-by-865904/ …";;;;"1104800629099319296";https://twitter.com/HeadlinesFin/status/1104800629099319296
;2019-03-10 17:44;0;0;"Pentair Plc $ PNR Share Price Declined While Water Asset Management Decreased by $982,054 Its Stake; Compton Capital Management Cut Position in Procter & Gamble Co $ PG by $338,429 as Stock Rose https://yomiblog.com/2019/03/10/pentair-plc-pnr-share-price-declined-while-water-asset-management-decreased-by-982054-its-stake-compton-capital-management-cut-position-in-procter-gamble-co-pg-by-338429-as-stock-rose/ …";;;;"1104800294800683008";https://twitter.com/BlogYomi/status/1104800294800683008
;2019-03-10 17:39;0;0;"$ PG the 20 MA on alert here pic.twitter.com/Knmuph3xiv";;;;"1104798876140294144";https://twitter.com/LlcBillionaire/status/1104798876140294144
;2019-03-10 17:36;0;0;"Osborne Partners Capital Management Has Trimmed Procter & Gamble Co $ PG Holding By $349,440; Petrus Trust Company Lta Upped By $355,712 Its Nci Building Sys $ NCS Holdinghttps://yomiblog.com/2019/03/10/osborne-partners-capital-management-has-trimmed-procter-petrus-trust-company-lta-upped-by-355712-its-nci-building-sys-ncs-holding/ …";;;;"1104798195169800192";https://twitter.com/BlogYomi/status/1104798195169800192
;2019-03-10 17:34;0;0;"Ambarella $ AMBA Market Value Rose While Natixis Decreased Holding; Procter & Gamble Co $ PG Holder Greenleaf Trust Has Upped Holding https://finheadlines.com/2019/03/10/ambarella-amba-market-value-rose-while-natixis-decreased-holding-procter-gamble-co-pg-holder-greenleaf-trust-has-upped-holding/ …";;;;"1104797718906585093";https://twitter.com/HeadlinesFin/status/1104797718906585093
;2019-03-10 17:32;0;0;"Procter & Gamble Co $ PG: Stock Institutional Investors Like https://whatsonthorold.com/2019/03/10/procter-gamble-co-nysepg-stock-institutional-investors-like/ …";;;;"1104797164960661504";https://twitter.com/whatsonthorold2/status/1104797164960661504
;2019-03-10 17:31;0;0;"Holder Capital Wealth Planning Boosted Procter & Gamble Co $ PG Stake; Illumina $ ILMN Shareholder Rfg Advisory Group Trimmed Its Holding by $849,000 https://yomiblog.com/2019/03/10/holder-capital-wealth-planning-boosted-procter-illumina-ilmn-shareholder-rfg-advisory-group-trimmed-its-holding-by-849000/ …";;;;"1104796906549592065";https://twitter.com/BlogYomi/status/1104796906549592065
;2019-03-10 17:29;0;0;"Procter & Gamble Co $ PG Holder Old Second National Bank Of Aurora Cut Its Stake as Market Valuation Rose; Royal Bank Of Canada Boosted Its Pandora Media $ Call $ P Holding by $320,800 as Market Valuation Were Volatilehttps://hinewulm.com/2019/03/10/procter-royal-bank-of-canada-boosted-its-pandora-media-call-p-holding-by-320800-as-market-valua/ …";;;;"1104796497890152448";https://twitter.com/UlmHi/status/1104796497890152448
;2019-03-10 17:21;0;0;"Btg Pactual Global Asset Management LTD Position in Anheuser Busch Inbev Sa/Nv $ BUD Has Decreased as Valuation Rose; Procter & Gamble Co $ PG Holding Has Lifted by Truepoint Inc https://yomiblog.com/2019/03/10/btg-pactual-global-asset-management-ltd-position-in-anheuser-busch-inbev-sa-nv-bud-has-decreased-as-valuation-rose-procter-gamble-co-pg-holding-has-lifted-by-truepoint-inc/ …";;;;"1104794391221276672";https://twitter.com/BlogYomi/status/1104794391221276672
;2019-03-10 17:14;0;0;"Micron Technology $ MU Holding Has Lifted by Boussard & Gavaudan Investment Management Llp; Procter And Gamble Co $ PG Shareholder Willow Creek Wealth Management Has Lifted Its Holding https://yomiblog.com/2019/03/10/micron-technology-mu-holding-has-lifted-by-boussard-procter-and-gamble-co-pg-shareholder-willow-creek-wealth-management-has-lifted-its-holding/ …";;;;"1104792681153261568";https://twitter.com/BlogYomi/status/1104792681153261568
;2019-03-10 17:04;0;0;"$ PG high OI range is 92.50 to 100.00 for option expiration 03/15/2019 # maxpain # options http://maximum-pain.com/options/open-interest/PG …pic.twitter.com/TBt0OiuyG9";;;# #;"1104790261668954112";https://twitter.com/optioncharts/status/1104790261668954112
;2019-03-10 17:02;0;0;"Wendell David Associates Decreased Procter & Gamble $ PG Position by $321,776; Stock Value Rose; Investment Counselors Of Maryland Has Raised Its Perficient $ PRFT Stake by $530,200 https://yomiblog.com/2019/03/10/wendell-david-associates-decreased-procter-stock-value-rose-investment-counselors-of-maryland-has-raised-its-perficient-prft-stake-by-530200/ …";;;;"1104789627569876992";https://twitter.com/BlogYomi/status/1104789627569876992
;2019-03-10 17:00;0;0;"Investors Buy Procter & Gamble $ PG on Weakness http://thelincolnianonline.com/?p=2759659";;;;"1104789233548607488";https://twitter.com/ThisLincolnian/status/1104789233548607488
;2019-03-10 16:55;0;0;"Centurylink Investment Management Company Trimmed Walmart $ WMT Position by $782,316; Valuation Rose; Procter & Gamble $ PG Share Value Rose While Budros Ruhlin & Roe Cut Its Position https://yomiblog.com/2019/03/10/centurylink-investment-management-company-trimmed-walmart-wmt-position-by-782316-valuation-rose-procter-gamble-pg-share-value-rose-while-budros-ruhlin-roe-cut-its-position/ …";;;;"1104787843426209797";https://twitter.com/BlogYomi/status/1104787843426209797
;2019-03-10 16:54;0;0;"As Pnc Finl Svcs Group $ PNC Stock Value Declined, Shareholder Endeavour Capital Advisors Boosted Its Stake; Procter & Gamble $ PG Holder Ami Investment Management Lowered Its Stake https://yomiblog.com/2019/03/10/as-pnc-finl-svcs-group-pnc-stock-value-declined-shareholder-endeavour-capital-advisors-boosted-its-stake-procter-gamble-pg-holder-ami-investment-management-lowered-its-stake/ …";;;;"1104787623405596672";https://twitter.com/BlogYomi/status/1104787623405596672
;2019-03-10 16:54;0;0;"As Visa $ V Market Valuation Rose, Crestwood Capital Management LP Lowered Stake by $2.62 Million; As Procter And Gamble Co $ PG Stock Value Rose, Holder Petrus Trust Company Lta Trimmed Its Holding https://yomiblog.com/2019/03/10/as-visa-v-market-valuation-rose-crestwood-capital-management-lp-lowered-stake-by-2-62-million-as-procter-and-gamble-co-pg-stock-value-rose-holder-petrus-trust-company-lta-trimmed-its-holding/ …";;;;"1104787529293852675";https://twitter.com/BlogYomi/status/1104787529293852675
;2019-03-10 16:45;0;0;"HOW TO DEAL WITH SHARE PRICE DECLINES WHEN SELLING OPTIONS? https://www.optiongenerator.com/blog/how-to-deal-with-share-price-declines … $ CVX $ MO $ PM $ PG $ KO $ NVDA $ AMD $ AAPL $ BIDU $ CSCO $ C $ T $ INTC $ XOM $ GOOGL $ FB $ AMZN $ NFLX $ GE $ TSLA $ MU $ ILMN $ RDS.A $ JNJ $ BA $ MO $ PM $ ABBV $ UNH $ GILD $ KHC $ CVS $ WBA $ O $ TGT $ QCOM $ BABA $ BPR";;;;"1104785361090367489";https://twitter.com/BiotechSmart/status/1104785361090367489
;2019-03-10 16:33;0;2;"Top 5 Foundation # Stocks for EVERY dividend growth investors portfolios, with updated metrics in 2019! $ PG $ JNJ $ T $ ED $ MCDhttps://www.dividenddiplomats.com/top-5-foundation-dividend-stocks-portfolio/ …";;;#;"1104782307746025472";https://twitter.com/DvdndDiplomats/status/1104782307746025472
;2019-03-10 15:39;0;0;"Procter And Gamble Co $ PG Holder Legg Mason Asset Management Japan Has Decreased Its Position as Market Valuation Rose; Forte Capital Holding in Nike $ NKE Has Increased as Shares Rose https://finreviewer.com/2019/03/10/procter-and-gamble-co-pg-holder-legg-mason-asset-management-japan-has-decreased-its-position-as-market-valuation-rose-forte-capital-holding-in-nike-nke-has-increased-as-shares-rose/ …";;;;"1104768716728922113";https://twitter.com/thefinreviewer/status/1104768716728922113
;2019-03-10 15:34;0;0;"As Broadridge Finl Solutions In $ BR Share Price Declined, Ensemble Capital Management Increased Its Position; Summit Securities Group Maintains Holding in Procter And Gamble Co $ PG https://finexaminer.com/2019/03/10/as-broadridge-finl-solutions-in-br-share-price-declined-ensemble-capital-management-increased-its-position-summit-securities-group-maintains-holding-in-procter-and-gamble-co-pg/ …";;;;"1104767484618526720";https://twitter.com/thefinreviewer/status/1104767484618526720
;2019-03-10 15:29;0;0;"Procter And Gamble Co $ PG Stock Price Rose While Uss Investment Management LTD Has Boosted Position by $527,800; Comerica Securities Has Raised Position in Accenture Plc Ireland $ ACN by $463,185https://hinewulm.com/2019/03/10/procter-and-gamble-co-pg-stock-price-rose-while-uss-investment-management-ltd-has-boosted-position-by-527800-comerica-securities-has-raised-position-in-accenture-plc-ireland-acn-by-463185/ …";;;;"1104766267817373696";https://twitter.com/UlmHi/status/1104766267817373696
;2019-03-10 15:25;0;0;"Echo Street Capital Management Trimmed Its Bemis $ BMS Holding by $10.46 Million; Share Value Rose; Procter & Gamble Co $ PG Shareholder Essex Financial Services Cut Its Holding https://finheadlines.com/2019/03/10/echo-street-capital-management-trimmed-its-bemis-bms-holding-by-10-46-million-share-value-rose-procter-gamble-co-pg-shareholder-essex-financial-services-cut-its-holding/ …";;;;"1104765284529946624";https://twitter.com/HeadlinesFin/status/1104765284529946624
;2019-03-10 15:09;0;0;"Clarkston Capital Partners Trimmed Its Procter And Gamble Co $ PG Holding; Sachem Head Capital Management LP Has Raised Autodesk $ ADSK Positionhttps://endigest.com/2019/03/10/clarkston-capital-partners-trimmed-its-procter-and-gamble-co-pg-holding-sachem-head-capital-management-lp-has-raised-autodesk-adsk-position/ …";;;;"1104761302457700352";https://twitter.com/bulletin_en/status/1104761302457700352
;2019-03-10 14:48;0;0;"Rfg Advisory Group Holding In Servisfirst Bancshares $ SFBS Was Increased; Benin Management Stake in Procter And Gamble Co $ PG Has Cut by $357,175 https://hinewulm.com/2019/03/10/rfg-advisory-group-holding-in-servisfirst-bancshares-sfbs-was-increased-benin-management-stake-in-procter-and-gamble-co-pg-has-cut-by-357175/ …";;;;"1104755865477885952";https://twitter.com/UlmHi/status/1104755865477885952
;2019-03-10 14:47;0;0;"Wells Fargo & Co $ WFC Holder Livingston Group Asset Management Southport Capital Management Lowered Position by $1.55 Million; Gilman Hill Asset Management Has Upped Its Stake in Procter And Gamble Co $ PG by $415,688 https://hinewulm.com/2019/03/10/wells-fargo-gilman-hill-asset-management-has-upped-its-stake-in-procter-and-gamble-c/ …";;;;"1104755586397339648";https://twitter.com/UlmHi/status/1104755586397339648
;2019-03-10 14:45;0;0;"As Procter And Gamble Co $ PG Stock Price Rose, Holder Capital Investment Counsel Cut Its Position by $653,835; Kelly Lawrence W & Associates Raised Home Depot $ HD Stake by $13.85 Million; Share Value Rose https://hinewulm.com/2019/03/10/as-procter-and-gamble-co-pg-stock-price-rose-holder-capital-investment-counsel-cut-its-position-by-653835-kelly-lawrence-w-share-valu/ …";;;;"1104755192040488961";https://twitter.com/UlmHi/status/1104755192040488961
;2019-03-10 14:30;0;0;"Awm Investment Company Has Boosted Stake in Century Casinos $ CNTY; Procter & Gamble Co $ PG Shareholder Truepoint Lifted Stake by $8.97 Million as Market Value Rose https://yomiblog.com/2019/03/10/awm-investment-company-has-boosted-stake-in-century-casinos-cnty-procter-gamble-co-pg-shareholder-truepoint-lifted-stake-by-8-97-million-as-market-value-rose/ …";;;;"1104751330474815492";https://twitter.com/BlogYomi/status/1104751330474815492
;2019-03-10 14:26;0;0;"Exxon Mobil $ XOM Holder Milestone Group Has Lowered Stake; As Procter And Gamble Co Com $ PG Stock Price Rose, Silvercrest Asset Management Group Has Lowered Holding https://hinewulm.com/2019/03/10/exxon-mobil-xom-holder-milestone-group-has-lowered-stake-as-procter-and-gamble-co-com-pg-stock-price-rose-silvercrest-asset-management-group-has-lowered-holding/ …";;;;"1104750300387336194";https://twitter.com/UlmHi/status/1104750300387336194
