username;date;retweets;favorites;text;geo;mentions;hashtags;id;permalink
;2019-03-18 10:05;0;0;"Friday top money flow names (volume traded x share price) $ BA $ AMZN $ AAPL $ FB $ MSFT $ TSLA $ AVGO $ ADBE $ NFLX $ NVDA $ GOOGL $ GOOG $ ORCL $ V $ BABA $ BAC $ INTC $ PG $ GE $ CSCO $ ULTA $ JPM $ LLY $ JNJ $ PFE $ QCOM $ CMCSA $ UNH $ AMD $ C $ MU $ DIS $ XOM $ BRK $ T $ PEP $ WFC $ HD $ LRCX $ ROKU";;;;"1107583707345489920";https://twitter.com/TheBurdetteLawF/status/1107583707345489920
;2019-03-18 09:52;0;3;"$ IGPK ALL IN THE PR. # cbd $ KO $ PEP DEAL HAPPENING! RUN TO DOLLARS NOT PENNYS. $ KGKG $ NNRX $ PSIQ $ NXMR $ CRON $ TLRY $ CGC $ APHA $ ACB $ OGRMF $ CAVR $ PNAT $ RDGL $ INND $ BEMG $ SHMP $ WDBG $ DVLP $ FTEG $ MLHC $ OSCYD $ BLSP $ OGRMF";;;#;"1107580457481367552";https://twitter.com/CamleeMediaGaFL/status/1107580457481367552
;2019-03-18 04:27;0;1;"$ PEP showing potential h&s on daily. pic.twitter.com/Pc9xd2Wm8Z";;;;"1107498617827401728";https://twitter.com/RichHamiltonJr/status/1107498617827401728
;2019-03-18 03:57;0;0;"Option Watchlist for Week of 3/18/19 - $ PEP $ AMZN $ BWA $ ABBV $ JWN $ TPR Chart Breakdowns and Price Targets here:https://stocktalkcentral.com/d/103-options-watchlist-for-week-of-3-18-19 …";;;;"1107491283369684993";https://twitter.com/StockTalkCentrl/status/1107491283369684993
;2019-03-18 02:28;2;8;"LOL! Gender inequality... mixed in with GMOs. Pepsi, yet another corporation that has gone full fledged social warrior. Shareholders of $ PEP prefer the money put into the dividend fund... individual shareholders may then decided what to do with their money.";;;;"1107468914970234882";https://twitter.com/MSPOA/status/1107468914970234882